,title,url,keywordes
0,BEWARE: Chinese Loan Apps and Youtube Comment Scams | Dhruv Rathee,https://www.youtube.com/watch?v=5iy4p_bYu5Q,Dhruv Rathee Dhruv Rathee Dhruv Rathee latest video indian youtuber khan sir khan sir patna chinese scammer scam loan loan app loan scams loan scams in india chinese loan app chinese loan app scam chinese loan app news chinese loan app fraud chinese loan app list fraud loan fraud chinese scams in hindi loan scam in hindi free loan apps free loan kaise lete hain free loan kaise le loan kaise le loan ke liye best app loan for students without pan card
1,The Apollo 11 Moon Landing Mystery | Neil Armstrong | Dhruv Rathee,https://www.youtube.com/watch?v=TTGczb8uLA0,Dhruv Rathee Dhruv Rathee Dhruv Rathee latest video indian youtuber khan sir khan sir patna moon mission apollo 11 neil armstrong neil armstrong interview neil armstrong death neil armstrong on moon apollo 11 launch apollo 11 landing neil armstrong real story apollo 11 real story apollo 11 real video apollo 11 khan sir neil armstrong drawing apollo 11 moon mission moon mission apollo 11 hindi nasa isro space moon landing mars space station moon landing
2,"The Science of Ghosts | Paranormal, Bhoots and Ouija Boards Exposed | Dhruv Rathee",https://www.youtube.com/watch?v=RPiXj1t4wRQ,Dhruv Rathee Dhruv Rathee Dhruv Rathee latest video indian youtuber ghost are ghosts real ghost hunting ghost caught on camera are ghosts real pewdiepie do ghosts exist superstitions in india ghost doctor bhoot ki kahani kya bhoot hote hain kya bhoot sach mein hote hain horror horror stories reality of ghost in hindi bhooton ki kahaniyan ghost story steve huff sushant singh rajput alive lekin steve huff sidharth shukla bhoot
3,How Russia is Losing to Ukraine | 7 Months Later | Dhruv Rathee ft. @Soch by Mohak Mangal,https://www.youtube.com/watch?v=bJHEPmu837Y,Dhruv Rathee Dhruv Rathee Dhruv Rathee latest video indian youtuber khan sir khan sir patna russia ukraine russia ukraine news russian ukraine war news vladimir putin vladimir putin russia ukraine ukraine russia news hindi russia ukraine war update russia ukraine war live why russia attacking ukraine raeson for russia ukraine war russia ukraine latest news hindi putin news russia ukraine war map russia vs ukraine live khan sir russia ukraine
4,Anti Hijab Protests in Iran | Explained by Dhruv Rathee,https://www.youtube.com/watch?v=q0PbcaBgmWk,Dhruv Rathee Dhruv Rathee Dhruv Rathee latest video indian youtuber khan sir khan sir patna iran iran protest iran protests over drought iran protests hijab iran protest al jazeera iran female protest iran women protest mahasa amini mahsa amini video arrest mahsa amini hindi iran protests explained iran protest explained in hindi iran protest in hindi hijab protest hijab iran womens protest
5,How Amul Saved India | The Untold Story of White Revolution | Dhruv Rathee,https://www.youtube.com/watch?v=1CR3hS5Y-PI,Dhruv Rathee Dhruv Rathee indian youtuber khan sir khan sir patna amul amul case study case study on amul Verghes Kurien Kheda satyagraha Polson Bombay Milk Scheme Tribhuvandas Patel Operation Flood amul business amul business model amul girl amul mascot white revolution father of white revolution amul full form amul case study vivek bindra dr. vivek bindra vivek bindra case study business models AMUL amul founder
6,How China Invaded Tibet | Escape of Dalai Lama | Dhruv Rathee,https://www.youtube.com/watch?v=X50iFxhUWiU,Dhruv Rathee Dhruv Rathee Dhruv Rathee latest video indian youtuber khan sir khan sir patna china tibet china tibet conflict china tibet war china tibet history china tibat conflict khan sir china tibet border china tibet war in hindi dalai lama xi jinping china tibet conflict 2022 tibet china khan sir tibet china conflict manchurian dynasty qing dynasty panchen lama PRC UN PLA buddhism
7,The Truth about Freebie Politics | Right or Wrong? | Dhruv Rathee,https://www.youtube.com/watch?v=xIEzhdj5G5k,Dhruv Rathee Dhruv Rathee Dhruv Rathee latest video indian youtuber khan sir khan sir patna freebies unsustainable arvind kejriwal narendra modi free ki revadi free electricity bjp aap inc subsidy free water freebies debate dhruv rathee latest video arvind kejriwal free electricity gujarat arvind kejriwal free bijli gujarat arvind kejriwal free ki revdi arvind kejriwal free narendra modi free rewari gujarat free electricity
8,How did British Empire take over India? | Fall of Mughal Empire | Dhruv Rathee,https://www.youtube.com/watch?v=3bZoB8PiXas,Dhruv Rathee Dhruv Rathee Dhruv Rathee latest video indian youtuber khan sir khan sir patna mughal emperor cbse removed mughals chola dynasty jahandar shah east india company mughal empire fall of mughals britain queen elizabeth queen british British east india company Robert clive battle of plassey battle of buxar NCERT NCERT class 8 Bengal British rule in india
9,The Untold Mystery of Indus Valley Civilization | Dhruv Rathee,https://www.youtube.com/watch?v=Lr7GMr1NzV0,Dhruv Rathee Dhruv Rathee Dhruv Rathee latest video indian youtuber khan sir khan sir patna indus valley civilization by khan sir indus valley civilization upsc indus valley indus valley civilization hindi indus valley civilization in hindi indus valley civilization documentary indus valley civilization harappan civilization end of indus valley civilization indus valley civilization language deciphered indus civilization harappa mohenjo daro harrapan
10,Hiroshima and Nagasaki | Why USA destroyed Japan? | WW2 | Dhruv Rathee,https://www.youtube.com/watch?v=mX3ZWEG9lyw,Dhruv Rathee Dhruv Rathee Dhruv Rathee latest video indian youtuber khan sir khan sir patna hiroshima nagasaki incident hiroshima nagasaki incident in hindi 1945 hiroshima nagasaki usa japan bomb hiroshima nagasaki day hiroshima nagasaki full movie in hindi hiroshima nagasaki full story usa vs japan war hiroshima nagasaki hiroshima day nagasaki day hiroshima nagasaki tragedy hiroshima nagasaki hindi hiroshima nagasaki attack year
11,How Adani Trapped NDTV | The Hidden Agenda | Ravish Kumar | Dhruv Rathee,https://www.youtube.com/watch?v=5No-IWBTBaQ,Dhruv Rathee Dhruv Rathee Dhruv Rathee latest video indian youtuber khan sir khan sir patna adani buys ndtv adani ndtv ravish kumar kamal khan ndtv ndtv share adani ndtv deal adani ndtv news ravish kumar ndtv ravish kumar ndtv sold adani ndtv gautam adani ravish kumar resignation ndtv share price ravish kumar latest adani acquire ndtv adani ndtv in hindi adani ndtv ravish kumar ravish kumar adani takeover finance money stock market stocks
12,Mystery of Red Plague | Invention of World’s First Vaccine | Dhruv Rathee,https://www.youtube.com/watch?v=qlMBNrY7ABo,Dhruv Rathee Dhruv Rathee Dhruv Rathee latest video indian youtuber khan sir khan sir patna smallpox red plague disease vaccine jenner Edward jenner history of vaccine worlds first vaccine mystery
13,Why People become Criminals? | The Problem of Liberty | Dhruv Rathee,https://www.youtube.com/watch?v=d0KuhikVnVs,Dhruv Rathee Dhruv Rathee Dhruv Rathee latest video indian youtuber khan sir khan sir patna india independence independence day independence day speech independence day india indian independence 75 years of independence 75 years of independence essay freedom modi red fort happy independence day 2022 15 august 2022 har ghar tiranga 75th independence day 2022 2022 independence day liberty inequality economics money economic liberty
14,Dark Reality of Cold Drinks | Dhruv Rathee,https://www.youtube.com/watch?v=ILIDPSItmK4,Dhruv Rathee Dhruv Rathee Dhruv Rathee latest video indian youtuber khan sir khan sir patna cold drink are cold drinks harmful cold drink effect on body cold drink effect on teeth cold drink pine ke nuksan cold drink pine ke fayde cold drink peene ke nuksan cold drink side effects is diet coke healthy cold drink kaise banti hai cold drink experiment sugar in coke is cold drink good for health soft drinks coca cola pepsi mirinda fanta
15,Laal Singh Chaddha Boycott | Is Aamir Khan Anti-Hindu? | PK | Dhruv Rathee,https://www.youtube.com/watch?v=JE22hiUR2dI,Dhruv Rathee Dhruv Rathee Dhruv Rathee latest video indian youtuber khan sir khan sir patna lal singh chaddha review lal singh chadda laal singh chaddha story kahani lal singh chaddha laal singh chaddha real lal singh chaddha wiki lal singh chaddha director lal singh chaddha trailer date lal singh chaddha hit or flop lal singh chaddha original laal singh chaddha collection laal singh chaddha real story lal singh chaddha real story boycott
16,Why China wants Taiwan? | Taiwan Crisis Explained | Dhruv Rathee,https://www.youtube.com/watch?v=oqC5mg2k4Tk,Dhruv Rathee Dhruv Rathee Dhruv Rathee latest video indian youtuber khan sir khan sir patna china taiwan china taiwan USA china taiwan news china taiwan latest news china taiwan live china taiwan news live china taiwan latest news live nancy pelosi taiwan china taiwan china news taiwan china invasion us china taiwan taiwan vs china news taiwan china tension what is china taiwan tension china vs taiwan war crisis china taiwan relations
17,Stop Wasting your Time! | The Scientific Way | Dhruv Rathee,https://www.youtube.com/watch?v=b8n-wpvBjrw,Dhruv Rathee Dhruv Rathee Dhruv Rathee latest video indian youtuber khan sir khan sir patna procrastination procrastination motivation procrastination meaning how to beat procrastination how to beat procrastination and laziness motivation procrastination sandeep maheshwari procrastination ted talk procrastination meaning in hindi how to beat procrastination in hindi how to beat procrastination muhammad ali procrastination hindi dhruv rathee latest video
18,Who Controls Antarctica? | Mystery of the 7th Continent | Dhruv Rathee,https://www.youtube.com/watch?v=JWgwHjfhA3A,Dhruv Rathee Dhruv Rathee Dhruv Rathee latest video indian youtuber khan sir khan sir patna antartica antarctica life biggest glacier in antartica geopollitics antartica 4k video test storming antartica why planes dont fly over antartica ghanshyam vyas antartica ownership antarctic treaty who owns antartica who actually owns antartica antarctica vlog antarctica geology who owns antarctica reaction antarctica who owns antarctica
19,Chernobyl Nuclear Disaster | Why it happened? | Dhruv Rathee,https://www.youtube.com/watch?v=t_cSk9tQQkk,Dhruv Rathee Dhruv Rathee Dhruv Rathee latest video indian youtuber khan sir khan sir patna chernobyl chernobyl disaster chernobyl nuclear power plant chernobyl documentary nuclear power plant radiation chernobyl explosion scene chernobyl movie chernobyl disaster in hindi chernobyl disaster explained chernobyl incident nuclear disaster russia ukraine chernobyl what happened in chernobyl chernobyl nuclear disaster disaster chernobyl disaster dhruv rathee
20,How Draupadi Murmu Won? | India’s First Tribal President | Dhruv Rathee,https://www.youtube.com/watch?v=85nMXO_nRxc,Dhruv Rathee Dhruv Rathee Dhruv Rathee latest video indian youtuber khan sir Khan sir draupadi murmu draupadi murmu president yashwant sinha yashwant sinha interview yashwant sinha president presidential election 2022 president election president election voting president president of india 2022 new president india new president president election 2022 draupadi murmu religion new president of india nda modi draupadi murmu kaun hai india elections
21,Life on Alien Planet? | James Webb Telescope Discoveries | Dhruv Rathee,https://www.youtube.com/watch?v=Ih_4C6DJ0EU,Dhruv Rathee Dhruv Rathee Dhruv Rathee latest video indian youtuber khan sir khan sir patna james webb telescope first image james webb space telescope first image james webb space telescope pictures guru purnima james webb space telescope photos guru purnima 2022 james webb space telescope twitter james webb telescope new images james webb first pictures james webb telescope launch date and time james webb earth space planet telescope
22,Mystery of Kohinoor | Curse of World's Most Famous Diamond | Dhruv Rathee,https://www.youtube.com/watch?v=ji1fQRWJqlc,Dhruv Rathee Dhruv Rathee Dhruv Rathee latest video indian youtuber khan sir khan sir patna kohinoor kohinoor diamond kohinoor hira history of kohinoor diamond history of kohinoor diamond in hindi shah jahan lord dalhousie prince duleep singh queen victoria east india company kohinoor diamond price where is kohinoor diamond now can kohinoor be brought back to india can kohinoor diamond be broken who have kohinoor can india get kohinoor back diamond queen
23,Why Shinzo Abe was Ass*sinated? | Why China celebrated? | Dhruv Rathee,https://www.youtube.com/watch?v=vh9rBp_4eHU,Dhruv Rathee Dhruv Rathee Dhruv Rathee latest video indian youtuber khan sir khan sir patna Shinzo abe who killed Shinzo abe japan india india Japan relations prime minster ex PM Shinzo abe attack why was Shinzo shot Japanese ex pm china south korea
24,Mystery of North Sentinel Island | The Last Stone Age Tribe in World | Dhruv Rathee,https://www.youtube.com/watch?v=HvWlcpf48x4,Dhruv Rathee Dhruv Rathee Dhruv Rathee latest video indian youtuber khan sir khan sir patna north sentinel island north sentinel island drone north sentinel north sentinel sentinel island north sentinel island tribe sentinelese tribe sentinelese tribe documentary sentinelese tribe attack sentinelese people mystery mysterious island john allen chau john allen chau last video north sentinel island hindi island north sentinel island real video
25,The Men who Built India | Untold Story of Tata | Dhruv Rathee,https://www.youtube.com/watch?v=TGHqBX1YJRc,Dhruv Rathee Dhruv Rathee Dhruv Rathee latest video indian youtuber khan sir khan sir patna tata ratan tata ratan tata biography ratan tata age 2022 world richest man 2022 ratan tata net worth 2022 tata history jamshedpur jamshedpur history story of tata jamsetji tata jamsetji tata story jamsetji nusserwanji tata dorabji tata tata group bharat ratna for ratan tata tata case study ratan tata speech taj hotel history tata business tata ipl
26,The End of Shiv Sena? | Maharashtra Political Crisis Explained | Dhruv Rathee,https://www.youtube.com/watch?v=wQhiQrt2TqQ,Dhruv Rathee Dhruv Rathee Dhruv Rathee latest video indian youtuber khan sir khan sir patna maharashtra political crisis uddhav thackeray eknath shinde shiv sena ncp maharashtra shiv sena rebel eknath shinde news birje shiv sena floor test mo da joshi mo da joshi shiv sena dharmaveer total mla of shiv sena ajay chaudhary shiv sena maharashtra political crisis explained bjp devendra fadnavis amit shah bal thackeray dhruv rathee maharashtra
27,Business Model of Bollywood | How Film Industry Earns Money? | Dhruv Rathee,https://www.youtube.com/watch?v=w6l4Gsqgi9U,Dhruv Rathee Dhruv Rathee Dhruv Rathee latest video indian youtuber khan sir how bollywood movies earn money how bollywood movies earn how do movies make money indian film industry business model bollywood film earning film industry business model movies earning bollywood box office collection 2022 movie earning in hindi brahmastra box office collection bollywood bollywood earnings movie paise kaise kamate hai salman khan income akshay kumar income
28,India has a Big Stray Dogs Problem | Dhruv Rathee,https://www.youtube.com/watch?v=tMsf6i7yID8,Dhruv Rathee Dhruv Rathee Dhruv Rathee latest video indian youtuber khan sir khan sir patna stray dogs stray dogs in india stray dog problem india's dog problem so many dogs in india how to control stray dogs india's dog population control stray dogs dogs india's stray dogs problem indian dogs facts about stray dogs stray dogs problem solution stray dogs solution stray dogs problem in society stray stray dog are stray dogs friendly
29,Nupur Sharma Controversy | Who was Right? | Freedom of Speech | Dhruv Rathee,https://www.youtube.com/watch?v=-05P5FB4AJc,Dhruv Rathee Dhruv Rathee Dhruv Rathee latest video indian youtuber khan sir khan sir patna nupur sharma uttar pradesh yogi adityanath nupur Sharma controversy prophet muhammad nupur sharma comment on muhammad upur sharma comment on muhammad what did nupur sharma say what did nupur say nupur sharma statement hindi
30,Agneepath Scheme Explained | Good or Bad? | Agniveers | Dhruv Rathee ft. @Soch by Mohak Mangal​,https://www.youtube.com/watch?v=Iwz_Vdz8EKw,Dhruv Rathee Dhruv Rathee Dhruv Rathee latest video indian youtuber khan sir khan sir patna agneepath scheme army agneepath army army what is agneepath scheme agneepath scheme hindi agneepath recruitment scheme agneepath recruitment agneepath scheme 2022 indian army agneepath scheme agneepath scheme in hindi agneepath scheme apply agneepath yojana agneepath yojana kya hai agneepath scheme details agneepath scheme eligibility agnipath agneepath
31,Monkey Man Mystery of Delhi l Kala Bandar of 2001 | Dhruv Rathee,https://www.youtube.com/watch?v=ZuKJpVNUHGg,Dhruv Rathee Dhruv Rathee Dhruv Rathee latest video indian youtuber khan sir khan sir patna Monkeyman Monkey man Mystery Kala bandar Monkey mystery 2001 Delhi Delhi 2001 Delhi monkey man Mumbai India
32,Johnny Depp vs Amber Heard Case | The Full Story | Dhruv Rathee,https://www.youtube.com/watch?v=5UmJwPivCHE,johnny depp johnny depp trial johnny depp vs amber heard johnny depp amber heard johnny depp court case johnny depp status camille vasquez johnny depp camille vasquez johnny depp lawyer camille johnny depp amber heard full story johnny depp verdict date johnny depp vs amber heard judgement johnny depp trial verdict defamation meaning johnny depp case brief birth flower june amber heard oonagh paige heard dhruv rathee dhruv rathee amber heard elon musk baby
33,India’s Richest Minority | How Zoroastrians became Rich? | Dhruv Rathee,https://www.youtube.com/watch?v=SRIooZz0bSI,Dhruv Rathee Dhruv Rathee Dhruv Rathee latest video indian youtuber khan sir khan sir patna parsi in india parsi community parsi religion parsi british parsi parsi religion in india parsi dharm parsi new year 2022 what do the parsis call their god aditya narayan parsi new year 2021 wishes navroz mubarak parsi new year wishes subhadra kumari chauhan onam 2021 boman irani parsis parsi rabada cyrus poncha tata group serum cyrus poonawala ratan tata
34,Is Taj Mahal a Temple? | The Mystery Explained by Dhruv Rathee,https://www.youtube.com/watch?v=pH5uKjcP5GE,Dhruv Rathee Dhruv Rathee indian youtuber khan sir khan sir patna taj mahal taj mahal history peeing human taj mahal documentary taj mahal information tejo mahalaya shiv mandir tejo mahalaya shiva taj mahal news taj mahal 22 rooms taj mahal 22 rooms mystery taj mahal 22 rooms history tejo mahalaya proof tejo mahalaya temple tejo mahalaya ka rahasya tejo mahalaya mahadev mandir taj mahal inside taj mahal video tejo mahalaya documentary tejo mahalaya
35,Mystery of Supersonic Airplane | Concorde Plane Crash | Dhruv Rathee,https://www.youtube.com/watch?v=y7zrjWp3fEk,Dhruv Rathee Dhruv Rathee concorde crash concorde plane concorde take off concorde sonic boom concorde aeroplane concorde supersonic plane concorde plane sound concorde airplane concorde auriga supersonic missile supersonic boom supersonic boom sound concorde crash footage concorde crash real footage concorde crash documentary concorde crash investigation supersonic airplane crash concorde airplane crash 2000 air france 4590 air france 4590 crash
36,Mystery of Titanic | How the World's Greatest Ship Disappeared? | Dhruv Rathee in Hindi,https://www.youtube.com/watch?v=id00R-3OmJ0,Dhruv Rathee indian youtuber khan sir khan sir patna dhruv rathee latest video dhruv rathee titanic 2 titanic picture titanic 2 full movie titanic ship accident video titanic ship kaise duba titanic ship story titanic scene titanic ship underwater titanic ship sinking scene titanic titanic heroine name and details titanic never sank titanic ship movie titanic ship video titanic story in hindi titanic story real mystery ship titanic story real life
37,Business Model of IPL | How IPL Teams Make Money? | Dhruv Rathee,https://www.youtube.com/watch?v=4DhK260KYzQ,Dhruv Rathee Dhruv Rathee Dhruv Rathee latest video indian youtuber khan sir khan sir patna ipl auction 2022 ipl 2022 ipl live ipl live match ipl 2022 highlights ipl business model dhruv rathee ipl business model ipl business model ipl live 2022 ipl live score 2022 ipl points table 2022 ipl 2022 points table ipl score 2022 tata ipl 2022 ipl 2022 match ipl 2022 schedule ipl list 2022 ipl orange cap 2022 live cricket ipl 2022 ipl money income
38,Sri Lankan Prime Minister Resigns! | Dynasty Rule Still Continues | Dhruv Rathee,https://www.youtube.com/watch?v=hdBUo3P-sU8,Dhruv Rathee Dhruv Rathee Dhruv Rathee latest video indian youtuber khan sir khan sir patna dhruv rathee latest video sri lanka news sri lanka crisis sri lanka news today sri lanka economic crisis in sri lanka Mahindra Rajapaksa mahindra rajapaksa resigns mahindra rajapaksa resigns 2022 mahindra rajapaksa recent sri lanka riots 2022 economic crisis sri lanka new pm sri lanka new president ranil wickramasinghe ranil wickremesinghe sri lanka news hindi
39,How Social Media Destroys Your Life? | Science behind Addiction | Dhruv Rathee,https://www.youtube.com/watch?v=bJj8XEw-zCg,Dhruv Rathee Dhruv Rathee Dhruv Rathee latest video indian youtuber khan sir khan sir patna social media addiction how to stop social media addiction social media addiction solved social media describe a person you follow on social media social media addiction short film how to get rid of social media addiction youtube addiction social media addiction 2022 phone addiction screen time facebook twitter instagram tiktok why TikTok is addicting
40,Cuba Missile Crisis | How USA and Soviet Union almost started WW3 | Dhruv Rathee,https://www.youtube.com/watch?v=_6M4rX-PYzs,Dhruv Rathee Dhruv Rathee Dhruv Rathee latest video indian youtuber khan sir khan sir patna cuban missile crisis cuba missile sankat cuba missile sankat by khan sir cuba missile crisis class 12 cuba missile crisis in hindi cuba missile crisis study iq cuba missile sankat kya hai cuba was seized by which country cuba missile crisis cuban missile crisis documentary usa vs ussr us vs ussr ussr usa missile world war 3 world war 3 news world war
41,Russia Turns Back! Latest Update from Ukraine | Dhruv Rathee,https://www.youtube.com/watch?v=_xVi4j5A-go,Dhruv Rathee Dhruv Rathee Dhruv Rathee latest video indian youtuber khan sir khan sir patna russia ukraine russia ukraine conflict explained russia ukraine news hindi russia vs ukraine war update in hindi putin russia ukraine war vladimir putin russia ukraine war ukraine and russia war reason russia ukraine war live russia ukraine war update russia ukraine news live update update on russia ukraine dow futures war bucha news bucha city bucha slovyansk ukraine
42,World's Harshest Lockdown in China | Zero COVID Policy | Dhruv Rathee,https://www.youtube.com/watch?v=j9VOQZX5btA,Dhruv Rathee Dhruv Rathee Dhruv Rathee latest video indian youtuber khan sir khan sir patna dhruv rathee latest video dhruv rathee covid 3rd wave zero covid policy covid china zero covid china covid surge shanghai beijing zero covid strategy xi jinping china covid 19 news zero covid china shanghai lockdown china lockdown shanghai lockdown drone china population 2022 covid 19 third wave covid 19 covid 19 news china covid 19 today's news
43,The Problem with Bulldozer Justice in India | Dhruv Rathee,https://www.youtube.com/watch?v=HzH71M5plAs,Dhruv Rathee Dhruv Rathee Dhruv Rathee latest video indian youtuber khan sir khan sir patna dhruv rathee dhruv rathee latest video top 10 indian youtubers trending make money jahangirpuri bulldozer baba song bulldozer wale baba bulldozer baba kaun hai up election result boris johnson on bulldozer narendra modi yogi adityanath
44,The Real Reason behind Communal Riots | Dhruv Rathee,https://www.youtube.com/watch?v=LwMutPnXnoA,Dhruv Rathee Dhruv Rathee Dhruv Rathee latest video indian youtuber khan sir khan sir patna dhruv rathee dhruv rathee latest video delhi jahangirpuri violence 1984 bokaro kashmir files tripura news jnu protest jnu violence ramnavmi violence jahangirpuri danga jahangirpuri bulldozer 1984 bulldozer modi bjp
45,The Dark Secret of Bill Gates | Becoming the World's Richest Man | Dhruv Rathee,https://www.youtube.com/watch?v=IFxmKHhZnPE,Dhruv Rathee Dhruv Rathee Dhruv Rathee latest video indian youtuber khan sir khan sir patna bill gates divorce settlement bill gates divorce bill melinda gates divorce bill gates divorce rate bill gates divorce reason worlds richest man richest rich Elon Musk warren buffet bill gates got divorce ann winblad bill gates exposed dark side of bill gates bill gates story bill gates house bill gates lifestyle bill gates vivek bindra
46,India's Worst Plane Crash | Only Mid-Air Collision in History | Dhruv Rathee,https://www.youtube.com/watch?v=klnYxLLcceE,Dhruv Rathee Dhruv Rathee Dhruv Rathee latest video indian youtuber khan sir khan sir patna charkhi dadri charkhi dadri mid air collision charkhi dadri crash charkhi dadri collision charkhi dadri collision in hindi plane crash video Charkhi-Dadri mid-air collision captain gennadi cherepanov mid air collision 1996 worst plane crashes plane mysteries plane mysteries in hindi plane crash today indian plane crash airplane crash bermuda triangle
47,Emergency in Sri Lanka! | Economic Crisis Explained | Dhruv Rathee,https://www.youtube.com/watch?v=LLw-T_d-wWo,Dhruv Rathee Dhruv Rathee Dhruv Rathee latest video indian youtuber khan sir khan sir patna sri lanka news sri lanka crisis sri lanka crisis explained sri lanka crisis hindi sri lanka army protest in Sri Lanka sri lanka economic crisis sri lanka protest sri lanka violence sri lanka economic emergency sri lanka food emergency sri lankan economic crisis economic emergency in sri lanka srilanka economic crisis sri lanka news hindi sri lanka news live
