,title,url,keywordes
97,Business Model of T20 World Cup | Explained by Dhruv Rathee,https://www.youtube.com/watch?v=Rym2dd1brE4,Dhruv Rathee Dhruv Rathee Dhruv Rathee latest video indian youtuber khan sir khan sir patna T20 World Cup ICC BCCI Cricket Virat Kohli India vs Namibia Indian cricket team business profit money FIFA business model IPL profit model how does IPL earn money who earns money from World Cup fifa business model How icc works Pakistan cricket team Jasprit Bumrah Rahul Dravid
98,Virat Kohli Controversy | Fabindia and CEAT Boycotts | Dhruv Rathee,https://www.youtube.com/watch?v=3gz3oYT9tFk,Dhruv Rathee Dhruv Rathee Dhruv Rathee latest video indian youtuber khan sir khan sir patna fabindia fabindia ad Aamir khan virat kohli Virat Kohli boycott ceat tyres tanishq Twitter Social Media t20 world cup india match t20 Virat Kohli birthday Virat Kohli birthday wishes Anushka sharma virat kholi daughter dhoni threat urdu urdu vs hindi
99,"Swami Vivekananda vs Andh Vishwas, Astrology and Cow Worship | Dhruv Rathee",https://www.youtube.com/watch?v=jWYUnmgQZfk,Dhruv Rathee Dhruv Rathee Dhruv Rathee latest video indian youtuber khan sir khan sir patna Swami Vivekananda Swami vivekananda biography swami vivekananda story swami vivekananda story in hindi swami vivekananda quotes swami vivekananda speech swami vivekananda speech at chicago vivekananda quotes motivational video biography indian history history education astrology mind reading
100,Facebook Papers | How Algorithms promoted Polarization and Hatred | Dhruv Rathee,https://www.youtube.com/watch?v=H0hy2QTqNuU,Dhruv Rathee Dhruv Rathee Dhruv Rathee latest video indian youtuber khan sir khan sir patna Facebook Facebook papers Facebook download Facebook login Twitter social media social dilemma profits Facebook whistleblower LinkedIn Frances haugen USA social media regulation algorithm YouTube mark Mark Zuckerberg Mark Zuckerberg net worth Elon Musk Jeff bezos Mark Zuckerberg wife
101,Dark Side of Stock Market | How Stock Market Manipulation works? | Insider Trading | Dhruv Rathee,https://www.youtube.com/watch?v=OH2--jzeZ9k,Dhruv Rathee Dhruv Rathee Dhruv Rathee latest video indian youtuber khan sir khan sir patna Stock Market Stock Market Manipulation Dark Side of Stock Market Profit motive What is insider trading insider trading pump and dump shorts what are shorts stock market bubble bitcoin crypto bitcoin news bitcoin price economy what is stock market how stock market works harshad mehta harshad mehta scam dark side of stock market
102,Aryan Khan Bail Granted | Sameer Wankhede Twist | Dhruv Rathee,https://www.youtube.com/watch?v=fpLAWWTJFag,Dhruv Rathee Dhruv Rathee Dhruv Rathee latest video indian youtuber khan sir khan sir patna Aryan Khan Shah Rukh Khan Cruise Ship Sameer Wankhede Aryan Khan court hearing Aryan khan bail Ananya Pandey Prabhakar Sail Prabhakar Sail interview K Gosavi Mukul Rohtagi Aryan khan news Aryan khan Wankhede hearing high court NCB Aryan khan video
103,6 Million Special Q&A | Who is Dhruv Rathee? | All Questions Answered!,https://www.youtube.com/watch?v=TiHT3EOgirg,Dhruv Rathee Dhruv Rathee Dhruv Rathee latest video indian youtuber khan sir khan sir patna Q&A Who is Dhruv Rathee Dhruv Rathee Girlfriend Question and Answer Travelling how to travel how to vlog critical thinking India education Dhruv Rathee education 5 million special 6 million special critical thinking skills andh Bhakti Bhakti andh Bhakt andhbhakt
104,Bangladesh Durga Puja and Singhu Border Case | Dhruv Rathee,https://www.youtube.com/watch?v=fp21Pmt1H-Y,Dhruv Rathee Dhruv Rathee Dhruv Rathee latest video indian youtuber khan sir khan sir patna Bangladesh Hindus Durga puja diwali Sikhs nihang who are nihangs lakhbir singh bangladesh violence modi BJP Farmers Lakhimpur Dusshera Ram Quran Guru Nanak Guru Grant Sahib
105,Why Air India failed? | Case Study of Air India | JRD Tata | Dhruv Rathee,https://www.youtube.com/watch?v=YeC4clsQbIo,Dhruv Rathee Dhruv Rathee Dhruv Rathee latest video indian youtuber khan sir khan sir patna Air India JRD Tata Tata Tata Airlines Why Air India failed fall of Air India rise of Air India history of Air India Singapore Airlines privatisation Ratan Tata descent of Air India aviation minister Air India share price Air India price indigo flight Tata group air asia vistara Air India news indian Air Force
106,Coal Shortage in India | Electricity Crisis | Dhruv Rathee,https://www.youtube.com/watch?v=vT7OYzyoAwI,Dhruv Rathee Dhruv Rathee Dhruv Rathee latest video indian youtuber khan sir khan sir patna Coal shortage Lebanon electricity how is electricity generated power outage power shortage power crisis india coal shortage india coal mining coal crisis mining delhi power cut power cut power cut today power cut india blackout China europe coal price blackouts
107,Lakhimpur Kheri Case | The Full Story | Ashish Mishra Arrest | Dhruv Rathee,https://www.youtube.com/watch?v=qNa6DdM3Fp4,Dhruv Rathee Dhruv Rathee Dhruv Rathee latest video indian youtuber khan sir khan sir patna Maharashtra bandh Maharashtra band Bharat bhandh Lakhimpur case Lakhimpur case full story Lakhimpur case details farmers Rakesh tikait Aryan Khan Ashish Mishra monu Mishra Lakhimpur Kheri news Lakhimpur incident Uttar Pradesh Lakhimpur kheri update Lakhimpur news Ajay Mishra hindi bjp Mahatma Gandhi
108,Pandora Papers Explained | Money Trail of Super Rich People | Dhruv Rathee,https://www.youtube.com/watch?v=Z-tMp5-33k0,Dhruv Rathee Dhruv Rathee Dhruv Rathee latest video indian youtuber khan sir khan sir patna Pandora Papers What are pandora papers Panama papers Sachin Tendulakar Anil Ambani Amitabh Bachchan finance financial leak data leak privacy offshore accounts tax havens what is tax havens what are offshore accounts income tax zero tax money super rich
109,Aryan Khan Arrest | Political Agenda against SRK? | Dhruv Rathee,https://www.youtube.com/watch?v=zl4LqMZ139Y,Dhruv Rathee Dhruv Rathee Dhruv Rathee latest video indian youtuber khan sir khan sir patna Aryan Khan Shah Rukh Khan Cruise Ship Farmers protest farmers Uttar Pradesh Lakhimpur Kheri Priyanka Gandhi Yogi Adityanath Rakesh Tikait Ajay Mishra Ajay Kumar Mishra Lakhimpur news Kisan Kisan andolan Sikhs Lucknow farmer SRK Aryan Khan update
110,What if Internet Crashes in the Whole World? | Dhruv Rathee,https://www.youtube.com/watch?v=lalOwOl2FAA,Dhruv Rathee Dhruv Rathee Dhruv Rathee latest video indian youtuber khan sir khan sir patna World Wide Web Internet what is Internet what is www Tim Berners lee Bitcoin cryptocurrency decentralization of Internet Facebook Instagram WhatsApp Google EPNS crypto how Internet works Can Internet be shut down is it possible to shut down the whole Internet internet www
111,Farmers in Lakhimpur and Aryan Khan Case | Dhruv Rathee,https://www.youtube.com/watch?v=qpHWsIXNIRY,Dhruv Rathee Dhruv Rathee Dhruv Rathee latest video indian youtuber khan sir khan sir patna Aryan Khan Shah Rukh Khan Cruise Ship Farmers protest farmers Uttar Pradesh Lakhimpur Kheri Priyanka Gandhi Yogi Adityanath Rakesh Tikait Ajay Mishra Ajay Kumar Mishra Lakhimpur news Kisan Kisan andolan Sikhs Lucknow farmer
112,How to Win the Olympics? | Ground Report at Ravi Dahiya's Village | Dhruv Rathee,https://www.youtube.com/watch?v=rO9VEY5tQlY,Dhruv Rathee Dhruv Rathee Dhruv Rathee latest video indian youtuber khan sir khan sir patna Ravi Dahiya Neeraj Chopa Tokyo Olympics Indian wrestling Dangal Dangal film Real Life dangal Haryana Sonipat Haryana Wrestler Neeraj Chopra Ad Cred Olympics Life of an athlete Inspirational video Motivational Video
113,Did Mahatma Gandhi try to save Bhagat Singh? | Gandhi Jayanti Special | Dhruv Rathee,https://www.youtube.com/watch?v=pbr4-Thu1Lw,Dhruv Rathee Dhruv Rathee Dhruv Rathee latest video indian youtuber khan sir khan sir patna Mahatma Gandhi Gandhi Jayanti October 2 anniversary Gandhi Gandhi speech Bhagat Singh Indian history Indian independence socialism Bhagat Singh speech Gandhi song Gandhi Jayanti status Gandhi drawing Lal Bahadur Shastri painting Viceroy Irwin Trial of Bhagat Singh Shaheed Bhagat singh Gandhi film Bhagat Singh film
114,What is Quad? । PM Modi in America । Quad vs China । Dhruv Rathee,https://www.youtube.com/watch?v=gYWXC3vQ1rs,Dhruv Rathee Dhruv Rathee Dhruv Rathee latest video indian youtuber khan sir khan sir patna Quad Quad countries quad full form quad summit quad summit 2021 quad upsc quad meaning quad members quad group modi in USA Modi in america modi modi in America 2021 quad study iq quad dhruv rathee quad china quad china reaction dhruv rathee latest video anjana om kashyap video modi Joe Biden meeting Joe Biden
115,How Rwanda became No.1 Country of Africa | Ground Report by Dhruv Rathee,https://www.youtube.com/watch?v=yoIvGRuA00s,Dhruv Rathee Dhruv Rathee Dhruv Rathee latest video indian youtuber khan sir khan sir patna Rwanda Ground Report Dhruv Rathee Kigali Singapore of Africa Umuganda Rwanda history Africa’s cleanest country Africa safest country Africa most developed country human development index Paul Kagame African Union Coinswitch bitcoin blockchain blockchain Africa cryptocurrency
116,Indira Gandhi's Emergency | Why it happened? | The Real Story | Dhruv Rathee,https://www.youtube.com/watch?v=nw-84LXi7Go,Dhruv Rathee Dhruv Rathee Dhruv Rathee latest video indian youtuber khan sir khan sir patna Indira Gandhi Emergency national emergency what is emergency 1975 Allahabad High Court who is Indira gandhi nehru Rajiv gandhi Sanjay gandhi why emergency happened indira narendra modi janata party history of india indian history navnirman andolan railway strike jp narayan
117,The 9/11 Attacks | What actually happened? | America | Dhruv Rathee,https://www.youtube.com/watch?v=5WmBt6BBUzs,Dhruv Rathee Dhruv Rathee Dhruv Rathee latest video indian youtuber khan sir khan sir patna World Trade Centre 9/11 attack 9/11 attack in hindi what happened on 9/11 9/11 documentary what is 9/11 osama bin laden turning point United States America USA United States of America World Event History September 11 plane crash memorial museum George bush obama
118,The Secret Organization Cleaning India | Ep.3 Gems of India | Dhruv Rathee,https://www.youtube.com/watch?v=HvZDi-YzPbo,Dhruv Rathee Dhruv Rathee Dhruv Rathee latest video indian youtuber khan sir khan sir patna Delhi Vrikshit Foundation Delhi Model Gems of India Swachh Bharat Cleaning Beach Cleaning Environment NGO Best NGO Best NGO Delhi Delhi NGO garbage collection waste disposal wwf motivational video inspirational video waste management treeman Afroz shah hero of india
119,What if India has 0% Income Tax? | Dhruv Rathee,https://www.youtube.com/watch?v=7ic6oOHobWw,Dhruv Rathee Dhruv Rathee Dhruv Rathee latest video indian youtuber khan sir khan sir patna income tax abolishing income tax tax in india zero income tax indirect tax direct tax income tax filing income tax return personal finance finance income tax calculator fuel tax excise duty what is tax tax slab house tax property tax GST Audit Mutual Funds efiling
120,Petrol Price Rise | What are Oil Bonds? | Dhruv Rathee,https://www.youtube.com/watch?v=DzuU_3lYQ8c,Dhruv Rathee Dhruv Rathee Dhruv Rathee latest video indian youtuber khan sir khan sir patna Petrol price petrol price rise oil bonds what are bonds what are oil bonds oil bond crude oil How crude oil works what is crude oil finance finance ministry loans vs bonds what are loans financial education bond market oil companies subsidy diesel price petrol price today petrol price hike
121,Reality of Savarkar and Subash Chandra Bose | Partition 1947 | Dhruv Rathee,https://www.youtube.com/watch?v=ryBA3kVJdx8,Dhruv Rathee Dhruv Rathee Dhruv Rathee latest video indian youtuber khan sir khan sir patna Partition partition plan partition of india partition 1947 Who caused partition Causes of partition of india independence day jinnah movie india Pakistan india Pakistan partition why did partition happen gandhi Jinnah Nehru Mountbatten savarkar Subash chandra bose who was savarkar Reality of savarkar bose film on bose
122,"What is Socialism? | Ideologies of Gandhi, Nehru and Bhagat Singh | Dhruv Rathee",https://www.youtube.com/watch?v=zwtfDT4fZ5o,Dhruv Rathee Dhruv Rathee Dhruv Rathee latest video indian youtuber khan sir khan sir patna what is socialism socialism socialism class 9 russian revolution socialism in hindi communism what is communism capitalism socialism vs communism democracy cooperatives gandhi amul jobs hiring hirect social justice socialism vs capitalism socialism meaning socialism in russia china why china is successful nehru Bhagat singh
123,World's Most Expensive Currency | Dhruv Rathee,https://www.youtube.com/watch?v=479L5HanGEM,Dhruv Rathee Dhruv Rathee Dhruv Rathee latest video indian youtuber khan sir khan sir patna Kuwait Kuwaiti Dinar Worlds most expensive currency best currency forex bitcoin cryptocurrency most valuable currency rupee dollar US dollar vs indian rupee dollar vs rupee Currency exchange rate euros us dollar indian rupee stock market forex trading what is forex exchange rates devaluation of rupee types of exchange rates floating exchange rate
124,Pakistan's Role in Taliban | Good Taliban vs Bad Taliban | Dhruv Rathee ft. @Soch by Mohak Mangal,https://www.youtube.com/watch?v=aAikZJvjFPw,Dhruv Rathee Dhruv Rathee Dhruv Rathee latest video indian youtuber khan sir khan sir patna Afghanistan Afghanistan latest news usa America in Afghanistan us army America US geopolitics Afghanistan govt zahir shah history of Afghanistan Pakistan Afghanistan live india india in Afghanistan History of taliban rise of taliban who are the taliban who is taliban Kabul fall of Kabul Kabul airport Taliban latest news Taliban takeover Imran khan
125,Taliban Takeover Afghanistan | Fall of Kabul | Why it happened? | Dhruv Rathee,https://www.youtube.com/watch?v=H-lnbvd1UV0,Dhruv Rathee Dhruv Rathee Dhruv Rathee latest video indian youtuber khan sir khan sir patna Afghanistan Afghanistan latest news usa America in Afghanistan us army us withdrawl America US geopolitics Afghanistan govt zahir shah history of Afghanistan Pakistan Afghanistan live india india in Afghanistan History of taliban rise of taliban who are the taliban who is taliban Kabul fall of Kabul Kabul airport Taliban latest news Taliban takeover
126,Partition 1947 । Why it happened? | India and Pakistan | Dhruv Rathee,https://www.youtube.com/watch?v=r2kKsjZPrVI,Dhruv Rathee Dhruv Rathee Dhruv Rathee latest video indian youtuber khan sir khan sir patna Partition partition plan partition of india partition 1947 Who caused partition Causes of partition of india partition horrors remembrance day partition of india documentary independence day jinnah movie 75 years of Independence india Pakistan india Pakistan partition why did partition happen gandhi Jinnah Nehru red fort vallabhbhai Patel Mountbatten
127,Kargil War | Why it happened? | Real Story of Vikram Batra | Shershaah | Dhruv Rathee,https://www.youtube.com/watch?v=uai9Dt595mc,Dhruv Rathee Dhruv Rathee Dhruv Rathee latest video indian youtuber khan sir khan sir patna Captain Vikram Batra Vikram Batra dimple Batra Vikram Batra wife shershaah Kargil Kargil documentary Kargil war Vikram Batra movie girlfriend LOC Kargil Vir Chakra Sidharth Malhotra Bollywood india Pakistan india Pakistan history Batra Kargil Kargil diwas
128,India's Best School? | Ep.2 Gems of India | Dhruv Rathee,https://www.youtube.com/watch?v=COI2h-61mME,Dhruv Rathee Dhruv Rathee Dhruv Rathee latest video indian youtuber khan sir khan sir patna Gems of India Education Indian Education Best School in India Jaisalmer Rajasthan India's Best School Best college in India Best university in India Jaisalmer tourism Rajasthan Tourism Delhi schools Arvind Kejriwal Delhi Model Rajasthan tourism schools google best education
129,Indian Hockey Comeback | Why did Hockey lose popularity to Cricket? | Tokyo Olympics | Dhruv Rathee,https://www.youtube.com/watch?v=o6eZwr3S5FY,Dhruv Rathee Dhruv Rathee Dhruv Rathee latest video indian youtuber khan sir khan sir patna Olympic Games Tokyo Tokyo Games Field Hockey india vs germany india vs germany hockey sreejesh srijesh india hockey olympics india hockey indian hockey hockey live hockey vs cricket dhyan chand who was dhyan chand Chak De India Shah Rukh Khan SRK Why is cricket so popular india olympics
130,Assam Mizoram Border Issue | History of Mizoram | Assam CM | Dhruv Rathee ft @Soch by Mohak Mangal,https://www.youtube.com/watch?v=VGR8wQ9Jr-4,Dhruv Rathee Dhruv Rathee Dhruv Rathee latest video indian youtuber khan sir khan sir patna Assam Mizoram assam history assam Mizoram border history of mizoram where is mizoram Assam latest news Mizoram latest news guwhati border dispute upsc assam Mizoram upsc North East India
131,Rise of Taliban | Afghanistan Crisis Continued | US Troops Return | Dhruv Rathee,https://www.youtube.com/watch?v=Jh72phku9Zg,Dhruv Rathee Dhruv Rathee Dhruv Rathee latest video indian youtuber khan sir khan sir patna Afghanistan Afghanistan latest news usa America in Afghanistan us army us withdrawl America US geopolitics Afghanistan govt zahir shah history of Afghanistan Pakistan Afghanistan live india india in Afghanistan History of taliban rise of taliban who are the taliban who is taliban
132,Mirabai Chanu | The Real Struggler | Tokyo Olympics 2021 | Inspiring | Dhruv Rathee,https://www.youtube.com/watch?v=vw83vmoFTks,Dhruv Rathee Dhruv Rathee Dhruv Rathee latest video indian youtuber khan sir khan sir patna tokyo olympics tokyo olympics 2021 olympics live tokyo live silver medal Mirabai Chanu meera bai chanu olympic 2021 meera bai olympic mirabai chanu world record mirabai chanu winning moment mirabai chanu interview mirabai chanu biography mirabai chanu silver medal mirabai chanu live mirabai chanu news olympics 2021 olympics 2021 india india
133,Pegasus Spyware | How Pegasus hacks your phone? | Israel NSO | Dhruv Rathee,https://www.youtube.com/watch?v=13XA8AyslpU,Dhruv Rathee Dhruv Rathee Dhruv Rathee latest video indian youtuber khan sir khan sir patna Pegaus Pegasus kya hai pegasus spyware how it works pegasus india pegasus khan sir pegasus dhruv rathee pegasus study iq pegasus aaj tak pegasus news pegasus debate surveillance surveillance kya hota hai pegasus meaning pegasus meaning in hindi pegasus project pegasus spyware price pegasus scandal india Israel NSO guardian Washington post what is spyware spyware
134,How Credit Cards Work? Should I own a Credit Card? | Dhruv Rathee,https://www.youtube.com/watch?v=cYMeZs_EcqE,Dhruv Rathee Dhruv Rathee Dhruv Rathee latest video indian youtuber khan sir khan sir patna Credit card what is a credit card best credit cards hdfc bank how do banks earn banks finance credit cards in india best credit card SBI cards debit card debit card vs credit card icici axis icici credit cards should I own a credit card
135,Space Tourism | Jeff Bezos vs Richard Branson vs Elon Musk | Dhruv Rathee,https://www.youtube.com/watch?v=R-6DorkdP28,Dhruv Rathee Dhruv Rathee Dhruv Rathee latest video indian youtuber khan sir khan sir patna Jeff bezos Blue origin Virgin Galactic Richard Branson Elon Musk SpaceX Jeff Bezos space Space tourism Space Travel Private Space travel space tourism cost virgin space tourism space tourism cost in india who is Richard branson Amazon Tesla Elon Musk spacex virgin airlines
136,Afghanistan Crisis | History of Taliban | US Troop Return | Explained by Dhruv Rathee,https://www.youtube.com/watch?v=051CBvanVwU,Dhruv Rathee Dhruv Rathee Dhruv Rathee latest video indian youtuber khan sir khan sir patna Afghanistan Afghanistan latest news usa America in Afghanistan us army us withdrawl America US geopolitics Afghanistan govt zahir shah history of Afghanistan Pakistan Afghanistan live india india in Afghanistan
137,Planting 3 Lakh Trees! | Treeman of Haryana | Ep.1 Gems of India | Dhruv Rathee,https://www.youtube.com/watch?v=W31qwhIbQf4,Dhruv Rathee Dhruv Rathee Dhruv Rathee latest video indian youtuber khan sir khan sir patna Treeman Treeman of Haryana india news live TrashTag Afroz Shah Champion of Earth United Nations Beach Cleaning Waste Disposal Garbage Collection Waste Management Waste Zero Waste Managment Zero Garbage Enviornment Ecology Enviornment Day WWF Motivational Video Inspirational video Tree planting how to plant a tree
138,Rabindranath Tagore | How a School Drop-Out Won the Nobel Prize | Dhruv Rathee,https://www.youtube.com/watch?v=HnpMTINOBHo,Dhruv Rathee Dhruv Rathee Dhruv Rathee latest video indian youtuber khan sir khan sir patna Rabindranath Tagore rabindra sangeet rabindranath tagore study iq rabindranath thakur rabindranath tagore songs rabindranath tagore kobita rabindranath tagore poems rabindranath tagore nobel prize rabindranath tagore biography into that heaven of freedom tagore vs gandhi tagore vs modi tagore vs thakur
139,Reality of Love J**** | Dhruv Rathee,https://www.youtube.com/watch?v=EPr1CQuQpYA,Dhruv Rathee Dhruv Rathee Dhruv Rathee latest video indian youtuber khan sir khan sir patna Religious conversions religion hinduism islam interreligious marriages marriages in india religion in india love dating pew survey pew research center pew research survey latest pew survey sikhism Christianity bollywood Aamir khan shah rukh khan Saif ali khan kareena kapoor dhruv rathee latest video
140,Cabinet Reshuffle of Modi Government | Good or Bad? | New Cabinet Ministers | Dhruv Rathee,https://www.youtube.com/watch?v=tfepSyCQsEY,Dhruv Rathee Dhruv Rathee Dhruv Rathee latest video indian youtuber khan sir khan sir patna Narendra Modi cabinet reshuffle today live cabinet ministers of india 2021 cabinet oath taking ceremony cabinet mantri kya hota hai cabinet news today cabinet reshuffle hindi cabinet reshuffle study iq cabinet vistar cabinet reshuffle modi cabinet reshuffle india cabinet minister list cabinet portfolios modi cabinet reshuffle Cabinet Reshuffle New cabinet
141,Why this African Country is special? | Dhruv Rathee,https://www.youtube.com/watch?v=IUjSJk45hd4,Dhruv Rathee Dhruv Rathee Dhruv Rathee latest video indian youtuber khan sir khan sir patna Worlds best country rwanda iceland norway worlds best country for women africa african countries women in parliament worlds most feminist country feminism rwanda women Best Country in the World Best country no 1 country in the world Investment Growth HDI Business Most Developed Country Top country in the world Top country Iceland New Zealand India
142,Extreme Heatwave in Canada | 50°C Temperature | Climate Change | Dhruv Rathee,https://www.youtube.com/watch?v=o-TMOeCDeus,Dhruv Rathee Dhruv Rathee Dhruv Rathee latest video indian youtuber khan sir khan sir patna Canada heatwave USA heatwave 49 degree 50 degree in Canada usa America Canada Lytton British Columbia climate change global warming renewable energy carbon tax what is carbon tax Canada temperature Canada in india Toronto heat dome Canada weather heat wave Canada heat wave
143,Third Wave of Coronavirus | Delta Plus Variant in India | Dhruv Rathee,https://www.youtube.com/watch?v=y1Pm2diAD34,Dhruv Rathee Dhruv Rathee Dhruv Rathee latest video indian youtuber khan sir khan sir patna Coronavirus COVID-19 corona india news india coronavirus india maharashtra coronavirus vaccine covid 19 covid19 covid19 vaccine coronavirus update coronavirus cases coronavirus gana coronavirus song economy Maharashtra lockdown third wave third wave of corona lockdown in india when will third wave come delta variant delta plus variant
144,World's First Country to make Bitcoin Legal Tender | Dhruv Rathee,https://www.youtube.com/watch?v=QW2A-cbMjLc,Dhruv Rathee Dhruv Rathee Dhruv Rathee latest video indian youtuber khan sir khan sir patna bitcoin bitcoin in india india news live Narendra Modi Rahul Gandhi Bitcoin in India Bitcoin Mining What is Bitcoin Bitcoin in Hindi Bitcoin trading Cryptocurrency Bitcoin kya Hai How to earn bitcoin Bitcoin Price How to buy in Bitcoin How to invest in bitcoin Coinbase Best Crypto App Best bitcoin app El salvador bitcoin vs dollar
145,Swami Vivekananda | How Naren became a Monk! | Dhruv Rathee,https://www.youtube.com/watch?v=PA80BSo8XQQ,Dhruv Rathee Dhruv Rathee Dhruv Rathee latest video indian youtuber khan sir khan sir patna Swami Vivekananda Swami vivekananda biography swami vivekananda story swami vivekananda story in hindi swami vivekananda quotes swami vivekananda quotes in hindi swami vivekananda speech swami vivekananda speech at chicago vivekananda quotes motivational video biography indian history history education
146,Twitter vs Modi Govt | Ravi Shankar Prasad Twitter Ban | Dhruv Rathee,https://www.youtube.com/watch?v=cTQbBrwS0vg,Dhruv Rathee Dhruv Rathee Dhruv Rathee latest video indian youtuber khan sir khan sir patna twitter india twitter ban twitter ban in india twitter block ravishankar twitter blocked it minister twitter news twitter news india twitter news today twitter vs india twitter vs govt twitter vs govt of india twitter vs indian government twitter vs it minister dhruv rathee twitter ravi Shankar prasad koo twitter vs koo koo app kangana ranaut
147,The Fall of Berlin Wall | Akhand Germany Unification | Ground Report by Dhruv Rathee,https://www.youtube.com/watch?v=dYqtgpBg1ag,Dhruv Rathee Dhruv Rathee Dhruv Rathee latest video indian youtuber khan sir khan sir patna Berlin Wall Fall of Berlin Wall Akhand Bharat Akhand Germany World War 2 Allies vs Axis Soviet Union East Germany West Germany and East Germany German unification unification of germany berlin germany history of europe european union history of germany skillshare
