,title,url,keywordes
372,Rafale Deal | The Complete Controversy Explained by Dhruv Rathee,https://www.youtube.com/watch?v=f88jxfwZODU,Dhruv Rathee Dhruv Rathee Dhruv Rathee latest video india news live Rafale Deal Rahul Gandhi Narendra Modi France India France Rafale Deal Rafale Rafale Deal latest news Dassault Rafale Scam modi rafale deal hindi Supreme Court Anil Ambani Mukesh Ambani Reliance Aaj Tak India TV Lallantop Defense Minister India Congress BJP Rafale india Dassault Rafale CAG PAC
373,Why BJP lost the 2018 Elections? Harsh Reality about why Indians are fed up of BJP | Dhruv Rathee,https://www.youtube.com/watch?v=eN7hKU5m_20,Dhruv Rathee Dhruv Rathee Dhruv Rathee latest video india news live Elections 2018 Elections Results BJP Bhartiya Janta Party Narendra Modi PM Modi Aaj Tak India TV Lallantop NDTV Rajasthan Madhya Pradesh chhattisgarh Telangana Mizoram Why BJP lost elections results 2018 elections results 2018 live election news election 2018 Assembly Elections Amit Shah Rahul Gandhi
374,2.0 - Science behind Rajnikanth 's Movie | Mobile Phone Radiation Explained by Dhruv Rathee,https://www.youtube.com/watch?v=A_Ls1GxlSiA,Dhruv Rathee Dhruv Rathee Dhruv Rathee latest video india news live 2.0 Robot 2.0 Rajnikanth Akshay Kumar Movie Review A R Rahman Science Cellphones Cellphone towers Birds Shankar Smartphones 2.0 review Boxoffice Radiation Cellphone towers birds Mobile phone radiation 2.0 rajnikanth superstar rajni rajni Rajnikanth movie Akshay kumar latest film Birds Conservation iPhone radiation
375,Why are Farmers Angry with Modi Govt? | Kisan Mukti March | Dhruv Rathee,https://www.youtube.com/watch?v=3NRHh4qnGz4,Dhruv Rathee Dhruv Rathee Dhruv Rathee latest video india news live Kisan Mukti March Kisan Long March Delhi Modi government India TV Aaj Tak Lallantop Farmers in India Kisan Indian Journalism Narendra Modi PM Modi latest BJP Congress kisan rally kisan andolan Farmers protest Farmers song Dilli Chalo india latest news Kisan march Modi govt Modi latest speech Farmer protests kisan Kranti yatra
376,Who to Vote in 2019 Lok Sabha Elections? | Analysis by Dhruv Rathee,https://www.youtube.com/watch?v=SOYiFgh9pWs,Dhruv Rathee Dhruv Rathee Dhruv Rathee latest video india news live Who to vote 2019 Elections Narendra Modi Rahul Gandhi Arvind Kejriwal BJP Congress Aaj tak India TV Lallantop Prime Minister of India Parliamentary Democracy Presidential Democracy Democracy of India Indian elections Rajasthan Elections Madhya Pradesh Elections Rajasthan election 2018 modi speech today 2019 elections india Zee News Lok sabha polls Voting PM Modi
377,Sambit Patra: The Harsh Truth | Bebak Ep.4 with Abhisar Sharma and Dhruv Rathee,https://www.youtube.com/watch?v=uXSajNn7Jhg,Dhruv Rathee Dhruv Rathee Dhruv Rathee latest video india news live Sambit Patra Abhisar Sharma Bebak Bebak with Abhisar Sharma Sambit Patra shamlessness sambit patra debate Aaj Tak India TV India Today Indian media Narendra MOdi BJP Amit Shah Journalism in india Rajdeep Sardesai Rohit Sardana Ravish Kumar Arnab Goswami Peeing Human Kumar Shyam Shameless Patra
378,Ravish Kumar Interviews Dhruv Rathee on NDTV Prime Time | Full Interview,https://www.youtube.com/watch?v=gM4BnpbCGMw,Dhruv Rathee Dhruv Rathee Dhruv Rathee latest video india news live Ravish Kumar Ravish Kumar latest NDTV NDTV Prime Time Dhruv Rathee interview Ravish Kumar interview kunal kamra prime time ravish kumar ravish kumar news ndtv news live today ndtv live news ravish report ravish ki report ndtv live Dhruv Rathee latest india today aaj tak zee news Arnab goswami Abhisar Sharma Indian Journalism Indian Media World Press Freedom Narendra Modi
379,India under Modi Govt | 4 years of Performance Rankings Analyzed by Dhruv Rathee,https://www.youtube.com/watch?v=U8ISnVlHV7w,Dhruv Rathee Dhruv Rathee Dhruv Rathee latest video india news live Modi Narendra Modi India Modi development Ease of doing Business HDI Human Development Index Modi latest speech Modi speech today Environment Happiness Press Freedom aaj tak India today Democracy Modi government performance 2018 modi government performance 4 years COngress Rahul gandhi modi government achivements Report Card modi govt 4 years of modi
380,Statue of Unity: The Harsh Reality | Analysis by Dhruv Rathee,https://www.youtube.com/watch?v=6sbPGzrXbts,Dhruv Rathee Dhruv Rathee Dhruv Rathee latest video india news live Statue of Unity Sardar Patel sardar vallabhbhai patel Sardar Patel Statue of unity Statue of liberty Eiffel tower Narendra Modi Statue of unity height the statue of unity statue of sardar patel India tourist attractions top india tourist places worlds biggest statue world's largest statue BJP Gujarat Shivaji Statue Tourism in India Taj Mahal monuments of India Iron man of India
381,CBI vs CBI: The Truth behind the Controversy | Explained by Dhruv Rathee,https://www.youtube.com/watch?v=3Vlh0vfBfHo,Dhruv Rathee Dhruv Rathee Dhruv Rathee latest video india news live CBI CBIvsCBI Alok Verma Rakesh Asthana Alok Verma CBI Narendra Modi Nirav Modi Supreme Court of India india news today CBI Director Moin Qureshi Explained modi latest speech Modi CBI Chief Democracy CBI news CBI controversy cbi latest news Rahul Gandhi
382,Interview of Ganga Activist with Dhruv Rathee | Sant Gopaldas | Ganga Part-2,https://www.youtube.com/watch?v=_oEmwzHPHBA,Dhruv Rathee Dhruv Rathee Dhruv Rathee latest video india news live Ganga River Ganga GD Agarwal Dhruv Rathee Interview Interview Journalism Ganga Activist Science Ayurveda Yoga Gangajal anna hazare Narendra Modi Modi latest speech Waterman of india Rivers of India Creators of Change Water pollution Air pollution Clean India Enviornment Indian media india news today Swachh Bharat india news live tv Gopaldas modi interview Eco-activism
383,Ganga : The 40 year long battle of GD Agarwal | Dhruv Rathee,https://www.youtube.com/watch?v=qv2h5fkFdBQ,Dhruv Rathee Dhruv Rathee Dhruv Rathee latest video india news live Holy ganga Ganga river GD Agarwal Science Gangajal Special powers of Ganga Environment Purification Yoga Ayurveda the story of Ganga Uttarkashi Gangotri Varanasi Narendra Modi Ecology Rivers of India Renewable Energy Ganges Yamuna Waterman of India Sadhguru Rally for rivers Eco-Activism Creators for change Water pollution Swachh Bharat Clean India Battle for Ganga
384,#MeToo Movement and MJ Akbar case | Bebak Ep. 3 with Abhisar Sharma and Dhruv Rathee,https://www.youtube.com/watch?v=oAzEyj88dmk,Dhruv Rathee Dhruv Rathee Dhruv Rathee latest video india news live Abhisar Sharma BEBAK Me Too Movement Me Too Metoo Me too india me too campaign Bollywood me too in hindi me too meaning Nana Patekar Tanushree MJ Akbar Narendra Modi Vikas Bahl Chetan Bhagat AIB Tanmay Bhat metoo movement What is #Metoo
385,Indian Rupee is on a Golden Run! 💰 | Ep.10 The Dhruv Rathee Show,https://www.youtube.com/watch?v=W95SuZOE0iY,Dhruv Rathee Dhruv Rathee Dhruv Rathee latest video india news live The Dhruv Rathee Show Indian Rupee Economics currency trading Narendra Modi Rupee vs Dollar Rupee falling against Dollar US dollar good news india TheDhruvRatheeShow Piyush Goyal GDP Growth rate India Economic report GDP Explained GDP in Hindi GDP of India West Bengal Mamta Banerjee rupee depreciation Investment Golden Run
386,A Mother's Voice from Uttar Pradesh Village | Ep.2 Bebak with Abhisar Sharma and Dhruv Rathee,https://www.youtube.com/watch?v=UlkaHyqU0iE,Dhruv Rathee Dhruv Rathee Dhruv Rathee latest video india news live Abhisar Sharma BEBAK Abhisar Sharma latest video Bebak series Mother Mother's day Uttar Pradesh Yogi Adityanath Narendra Modi Enciphilitus Malnutrition Povert in India Ground report Aaj tak ABP News India TV DhruvRathee PM Modi latest Uttar Pradesh Report Villages in India Vivek Tiwari Mother's voice indian mother indian mom
387,Reality of Journalists under Modi govt | Ep.1 Bebak with Abhisar Sharma and Dhruv Rathee,https://www.youtube.com/watch?v=gXB9n3dp6Eg,Dhruv Rathee Dhruv Rathee Dhruv Rathee latest video india news live Bebak with Abhisar Sharma Abhisar Sharma Bebak Journalists Journalism Narendra Modi Modi govt Ravish Kumar Aaj Tak India today India news today Punya Prasun Bajpai ABP News Abhisar Sharma latest DhruvRathee Dhruv Rathee abhisar sharma India TV PM Modi latest Jobs Jobs in India
388,Vijay Mallya: Who helped him Escape? | Analysis by Dhruv Rathee,https://www.youtube.com/watch?v=dnZLGpeG5tA,Dhruv Rathee Dhruv Rathee Dhruv Rathee latest video india news live Vijay Mallya Arun Jaitley Finance Minister Finance FM Arun Jaitley Vijaya Mallya Latest News Vijay Mallya Lifestyle Narendra Modi Pm Modi latest interview 9000 crore Kingfisher Kingfisher airlines Amit Shah mallya Nirav Modi State bank of India Punjab National Bank PNB SBI PNB Scam Mehul Choksi Vijay Mallya Issue CBI India Vijay Mallya Scam Congress Rahul Gandhi Business Tycoon Money
389,Teaser: Bebak with Abhisar Sharma and Dhruv Rathee | Releasing 20th September,https://www.youtube.com/watch?v=wuA6EhNoZdA,Dhruv Rathee Dhruv Rathee Dhruv Rathee latest video india news live Aaj tak Abhisar Sharma Ravish Kumar Bebak Bebak with Abhisar Sharma Abhisar Sharma The wire Viond Dua Indian journalism Teaser trailer Teaser promo Journalist India tv news india tv ABP News ABP News Indian news channels indian media
390,Demonetization: Final Analysis of the Masterstroke by Dhruv Rathee [UPDATED],https://www.youtube.com/watch?v=_rJtMfi3cp0,Dhruv Rathee Dhruv Rathee Dhruv Rathee latest video india news live Demonetization Money Narendra Modi Rahul Gandhi Arvind Kejriwal GDP GDP of India GDP growth Economy Taxes in India Manmohan Singh Jobs in India IT jobs Business DeMo Small businesses PayTM Cashless Income tax returns Demonetization in India Analysis by Dhruv Rathee DhruvRathee
391,Andh Bhakti vs Science: How to Research Scientifically? | Dhruv Rathee,https://www.youtube.com/watch?v=s_5MryQB76M,Dhruv Rathee Dhruv Rathee Dhruv Rathee latest video india news live Science Research papers How to research stocks How to research a topic Science experiments Basics of Science Andh Bhakts Narendra Modi PM Modi types of scientific researches phd Modi Bhakts science in hindi Gaumutra Cow Urine Cow urine magic
392,Kerala Floods: Can future disasters be prevented? | Ft. Poojan Sahil and Dhruv Rathee,https://www.youtube.com/watch?v=2YH3u86VQFY,Dhruv Rathee Dhruv Rathee Dhruv Rathee latest video india news live Kerala Kerala Floods Kerala news kerala news today kerala floods 2018 kerala new kerla baad donation kerala donation latest kerala news Best state of India India Aaj tak india today news Poojan Sahil Vinod Dua The Wire South India CM of kerala Cheif minister Narendra Modi Qatar UAE Enviornment conservation Ecology Science
393,Atal Bihari Vajpayee: Best PM of India? | Analysis by Dhruv Rathee,https://www.youtube.com/watch?v=CGrxiAIUiNw,Dhruv Rathee Dhruv Rathee Dhruv Rathee latest video india news live Atal Bihari Vajpayee Atal Bihari Vajpayee best speech Pm of india Prime Minister India Atalji speeches Speech Atal Bihari Latest News Atal Vajpayee Atal Vajpayee Vajpayee news hindi Narendra Modi BJP Former PM Vajpayee Vinod dua Foriegn Policy Economy Education Golden Quadilatrel Highway Aaj Tak Quint The Wire
394,Are you an Adarsh Indian? | Independence Day Special Pee News ft. Akash Banerjee and Dhruv Rathee,https://www.youtube.com/watch?v=s-ulDo8OKSs,Dhruv Rathee Dhruv Rathee Dhruv Rathee latest video india news live India news Indian India indian national anthemn Deshbhakt Akash Banerjee Satire Indian Parody independence day independence day special independence day song independence day status india news aaj tak Pee News Adarsh Indian
395,Punya Prasun Bajpai: The Truth behind ABP News Resignation | Dhruv Rathee,https://www.youtube.com/watch?v=wfF5Q17lYy4,Dhruv Rathee Dhruv Rathee Dhruv Rathee latest video india news live ABP News abp news live abp news master stroke Punya Prasun Bajpai Punya Prasoon Vajpayee Abhisar Sharma Ravish Kumar NDTV india news today india news channel aaj tak Zee News Punya Prasun Bajpai Resignation abp news punya prasun bajpai TheWire Journalism India News
396,Mutual Funds Explained by Dhruv Rathee (Hindi) | Learn everything on Investments in 2020!,https://www.youtube.com/watch?v=8A3s9WP_7l4,Dhruv Rathee Dhruv Rathee Dhruv Rathee latest video Mutual Fund Mutual funds What are mutual funds What is a mutual fund Investment Best Mutual Funds to invest in 2018 Best Mutual Funds of 2018 top 10 mutual funds for SIP SIP mutual funds sahi hai Stock Market SBI mutual fund HDFC ICICI mutual fund Reliance Mutual funds Hindi Funding Tax mutual funds india best mutual funds Types of mutual funds Kuvera
397,Pakistan ka Deshdrohi | Exclusive Interview of Dhruv Rathee with Pakistani Human Rights Activist,https://www.youtube.com/watch?v=Dutvai4El0w,Dhruv Rathee Dhruv Rathee Dhruv Rathee latest video india news live India pakistan Pakistan pakistan news pakistan news live human rights Activists pakistan pm imran khan waqass goraya india pakistan border india pakistan news human rights in india Interview with Dhruv Rathee Exclusive interview with Dhruv Rathee dhruv rathee on kanhaiya kumar Manish Sisodia Narendra Modi BJP PTI pakistani reacts
398,Cow Urine Magic! | Hidden Secret in Gaumutra Explained by Dhruv Rathee,https://www.youtube.com/watch?v=rjMbE9flUhQ,Dhruv Rathee Dhruv Rathee Dhruv Rathee latest video Cow Urine Gaumutra Gomutra cow urine benefits cow urine ke fayde in hindi cow urine therapy cow urine cow urine drinking in india gaumutra ark Patanjali gaumutra pine ke fayde Health health tips in hindi health badhane ke tips gomutra ke fayde Baba Ramdev patanjali products patanjali sim card Andh Bhakts Narendra Modi PM Modi
399,Rahul Gandhi vs PM Modi Speech: Who was better? | Analysis by Dhruv Rathee,https://www.youtube.com/watch?v=Lem7KgAb9SY,Dhruv Rathee Dhruv Rathee Dhruv Rathee latest video rahul gandhi narendra modi rahul gandhi speech parliament narendra modi speech Rahul gandhi hugs narendra modi PM Modi latest speech rahul gandhi wink rahul gandhi hug No-Confidence Motion rahul gandhi hugs narendra moid rahul hug modi hug
400,Photoshopped Videos created using Artificial Intelligence!! | Explained by Dhruv Rathee,https://www.youtube.com/watch?v=EW64ikvzHOI,Dhruv Rathee Dhruv Rathee Dhruv Rathee latest video Machine Learning AI Neural Network Obama India news live india news today artificial intelligence Photoshop How to How machine learning works How ai works how artificial intelligence works deepfakes machine learning tutorial photoshop tutorial photoshop editing photoshop tutorial in hindi hindi photoshop video editing Dhruv Rathee machine learning technology gyan technical Education
401,Dhruv Rathee's Youtube Journey & Biography | Interview with Brut India,https://www.youtube.com/watch?v=dHKAzSkHhNs,Dhruv Rathee Dhruv Rathee Dhruv Rathee latest video India News Live Dhruv rathee interview Dhruv Rathee Biography Dhruv Rathee Latest Dhruv Rathee Latest Video Brut Facebook Youtube Biography Dhruv Rathee Exposed wiki Dhruv Rathi Dhruv Rathee Wiki Birthplace Vinod Dua TheWire Aaj Tak News today india news today
402,"Whose Black Money is in Swiss Banks? | Ep.9 The Dhruv Rathee Show [Indian Rupee, Foreign Expenses]",https://www.youtube.com/watch?v=UdNe4Bv8ARY,Dhruv Rathee Dhruv Rathee Dhruv Rathee latest video India news live good news India live news today news aaj tak live news live today Black Money Swiss banks Banks Money Indian Rupee US Dollar Amit Shah Narendra Modi Modi foreign trip Monetization Bhartiya Janta Party Richest party BJP AAP Modi govt indian govt black money 100 days 15 lakhs modi Switzerland Dhruv Rathee Show
403,Is India World's Most Dangerous Country for Women? | Analysis by Dhruv Rathee,https://www.youtube.com/watch?v=LZ_R-sqksec,Dhruv Rathee Dhruv Rathee Dhruv Rathee latest video Thomas Reuters United Nations Ranking Women Feminism Feminism in india India Survey india worst country for women Is india safe is india safe to travel Country ranking world's best country DHruv Rathee Analysis women empowerment women education girl child in india beti bachao Thomas Reuters Foundation NGO
404,"Why is your Privacy & Data so Important? | Dhruv Rathee explains Cambridge Analytica, PayTM, Aadhaar",https://www.youtube.com/watch?v=-Au5PxsAjMk,Dhruv Rathee Dhruv Rathee Dhruv Rathee latest video Privacy why is privacy important Data Protection GDPR Online privacy Cambridge Analytica Facebook Cambridge Analytica hindi PayTM Aadhar card Aadhar paytm kyc paytm earn money Narenda Modi Namo app Narendra Modi app Narendra Modi latest data privacy paytm promo code Data Protection law Save our privacy Privacy Tips
405,Kejriwal vs LG: What is happening in Delhi? | Explained by Dhruv Rathee,https://www.youtube.com/watch?v=fSl5nOT82bM,Dhruv Rathee Dhruv Rathee Dhruv Rathee latest video India news live Arvind Kejriwal Narendra Modi AAP Delhi government Delhi IAS IAS officer IAS press conference IAS interview UPSC news aaj tak news today news live today Leutinent Governor delhi lg IAS association IAS delhi issue Dharna IAS strike meeting Rahul Gandhi Congress BJP upsc 2018 upsc topper India Indian government Modi govt kejriwal kejriwal latest modi latest LG LG electronics
406,Alt News Founder Pratik Sinha with Dhruv Rathee | Casual Interview in Germany,https://www.youtube.com/watch?v=5cOvSw0lqNQ,Dhruv Rathee Dhruv Rathee Dhruv Rathee latest video Alt News Pratik Sinha Interview Dhruv RAthee INterview Exclusive Interview Alternative Media Germany Global Media Forum Best Journalist in India Journalism India news live india news today Talk Show Fact Checking Outlook Media Event india tv live INdian Media Bonn Indian in germany Europe
407,Every Indian on WhatsApp Must Watch This Video | Dhruv Rathee,https://www.youtube.com/watch?v=iRZq5XWdWSA,Dhruv Rathee Dhruv Rathee Dhruv Rathee latest video WhatsApp Indian on WhatsApp WhatsApp video Facebook Social media Assam India Mob rule india Narendra Modi WhatsApp forward BJP Bharatiya Janta Party Congress Thewire Vinod dua Viral messages Twitter WhatsApp hacks and tricks WhatsApp tricks
408,Exclusive Interview of an Indian Soldier with Dhruv Rathee | Ground Reality of Indian Jawan,https://www.youtube.com/watch?v=0eA7F63Aoh0,Dhruv Rathee Dhruv Rathee Dhruv Rathee latest video Exclusive Interview Interview Dhruv rathee Interview indian jawan jawan indian army interview indian army paramilatry Kashmir Pensions Money salary Indian Paramilitary ssb interview ssb ssb training bsf bsf training army training army song army movies defence defence academy India Exclusive interview with dhruv Rathee india news soldier indian soldier
409,Bangladeshi Immigrants in India? | Citizenship Amendment Bill Explained by Dhruv Rathee,https://www.youtube.com/watch?v=15VQkurX5yk,Dhruv Rathee Dhruv Rathee Dhruv Rathee latest video DhruvRathee Assam Citizenship Amendment Bill Assam protests Bangaldesh Bangladeshi Immigrants Indian citizenship How to get indian citizenship Assam migrants Assam Accord north east states north east india Bill Tax Finance Citizenship bill assam assam news live citizenship amendment bill 2016 Narendra Modi BJP Ambani tribes of assam assam culture
410,Truth behind PayTM by Dhruv Rathee | Cobrapost Operation 136,https://www.youtube.com/watch?v=cseroHjs__E,Dhruv Rathee Dhruv Rathee Dhruv Rathee latest video PayTM paytm kyc paytm promo code paytm cash Money Reality of paytm PayTm exposed bank transfers mobile banking online banking cashless cashless india cashless economy paytm app ios app android apps narendra modi vijay shekhar paypal banking data privacy facebook Cobrapost Cobrapost operation 136 Indian media Media Indian news channel
411,How to start a Business by Dhruv Rathee | Being an Entrepreneur in India,https://www.youtube.com/watch?v=uOA5h_KdjO4,Dhruv Rathee Dhruv Rathee Dhruv Rathee latest video How to start a business How to be an entrepreneur Entrepreneurship Business in india Entrepreneur ideas ENtrepreneur motivation start up ideas start up start up business start up business in india start up india startup stories startup india startup business ideas business business loan motivation best start up ideas how to start up how to do business types of business income tax GST
412,BJP vs Congress: Reality of Karnataka Results by Dhruv Rathee | Yedyurappa CM,https://www.youtube.com/watch?v=gQWI9EssL0c,Dhruv Rathee Dhruv Rathee Dhruv Rathee latest video Karnataka Karnataka Results Karnataka news Karnataka elections Karnataka CM Karnataka latest news Yedyurappa Vinod Dua TheWire Jan gan Man ki baat Congress JDS Bhartiya Janta Party Amit Shah Game of Thrones Adani Ambani Narendra Modi Governor Vajubhai Vala Janta Dal Secular Government Karnataka Election 2018 New CM
413,World's Worst Pollution! | India v/s Europe Analysis by Dhruv Rathee,https://www.youtube.com/watch?v=Yo_mO0L8uE4,Dhruv Rathee Dhruv Rathee Dhruv Rathee latest video Air pollution National Clean Air Policy Clean Air Enviornment Ecology Clean India Air pollution delhi Delhi Smoke Air Purifier Forest Adani Ambani Narendra Modi WHO World Health Organisation Air Pollution in India Air Pollution in Hindi Air pollution project Pollution Pollution project pollution in Hindi Pollution in india top 10 top 10 most polluted cities World's Worst Europe NCAP
414,100% Village Electrification: Is it true? | Dhruv Rathee Facebook Live,https://www.youtube.com/watch?v=sQuxrOvXUrM,Indian village electrification Narendra Modi Modi Prime Minister Electricity Solar Panels Dhruv Rathee DhruvRathee Dhruv Rathee Electrified Villages Renewable Energy Dhruv Rathee Live DHruv Rathee Latest Video New India India 2022 Government Transmission electrification of railways
415,Is Modi Govt interfering in Supreme Court? | Explained by Dhruv Rathee,https://www.youtube.com/watch?v=6DcltISVybI,Supreme Court India Narendra Modi Collegium Appointment of Supreme court judges SC Judges government Vinod Dua TheWire Jan Gan Man ki Baat Justice Joseph Chief Justice of India Dipak Misra CJI Supreme Court of India Supreme court cases Supreme court news Modi latest news Dhruv Rathee DhruvRathee Dhruv Rathee Dhruv Rathee latest video How are judges appointed? How are supreme court judges appointed? judiciary legislature Supreme court collegium
416,Save our Forests! | National Forest Policy 2018 Explained by Dhruv Rathee,https://www.youtube.com/watch?v=jHmXSpTVjZA,Save our forests Forest National Forest Policy Forest Policy 2018 Forest Policy 1988 India Indian Government Indian forest Trees Save trees Ecology Eco-friendly Indian Environment Environment Tribals Indegenous trees Dhruv Rathee Dhruv Rathee DhruvRathee
417,Maun Modi and Whataboutery on Unnao & Kathua | Dhruv Rathee,https://www.youtube.com/watch?v=KOudMPiJFBI,Unnao Kathua Narendra Modi Andh Bhakts Whataboutery india Maun Modi Kathua Case Dhruv Rathee Dhruv RAthee DHruvRAThee Dhruv Rathee Video Kathua News Kathua Update Asifa Kathua Asifa BJP MLA BJP Bhartiya janta party Unnao case Unnao news Unnao update india latest news news
418,"Indian Police is a Puppet of Netas! | Police Reforms Solutions by Dhruv Rathee [Unnao, Kathua]",https://www.youtube.com/watch?v=oOw-6ZkYbv4,Indian Police Police Reforms Indian Police Reforms Indian Police service IPS Puppet India UP Unnao UNnao case SSC Scam Karni Sena Solutions How to reform Indian Police How to India Police Siren Indian Police Siren Indian Police Training Police training Media DGP Narendra MOdi Yogi Adityanath Dhruv Rathee DhruvRAthee Dhruv Rathee Dhruv Rathee Videos Dhruv Rathee Exposed unnao kathua
419,Which is the Best Country in the World? | Dhruv Rathee Analysis for 2018,https://www.youtube.com/watch?v=Uu96gewkN20,Best Country in the World Best country Best Country in world Best country in the world in hindi best country in the world to live best country in the world 2018 best country in the world 2017 Country no 1 country in the world Dhruv Rathee Dhruv Rathee DHruvRathee Investment Growth HDI Business Ease of doing business Happiness Most Developed Country Top country in the world Top country Norway Denmark Switzerland Iceland New Zealand India
420,Biggest Exposé of Indian Media!! | Cobrapost Operation 136 by Dhruv Rathee,https://www.youtube.com/watch?v=6zx-TpcdyZo,Indian Media Cobrapost Cobrapost Sting Operation 136 Biggest Expose Indian Media exposed india news live india news today india news channel media on india Mainstream Media Republic TV INdia TV ScoopWhoop Dhruv Rathee DHruvRathee DHruv Rathee Latest Video Dhruv Rathee Cobrapost operation 136 best media in india biggest media channel Rajat Sharma Arnab Goswami
421,"RTI Activists in India | Ep.8 The Dhruv Rathee Show (Demonetisation,  Unemployment Surveys)",https://www.youtube.com/watch?v=zE_tnXDXlaI,The Dhruv Rathee Show Dhruv Rathee Dhruv Rathi Dhruv Rathee Show RTI RTI Act RTI Activists Unemployment Demonetisation India Narendra Modi RTI Act 2005 in hindi RTI online RTI Act 2005 in english Rti Activist News Politics India news show news live news today india news live india news today india news channel BJP daily news
422,Finance Bill 2018 by Dhruv Rathee | Foreign Funding Legalized!,https://www.youtube.com/watch?v=O4ypoiHZOCs,Finance Bill 2018 Finance Bill Law Government of India Bill Parliament bill Amendment Politcial Party Politcial Parties finance commission finance minister finance management narendra modi Modi speech Dhruv Rathee DhruvRathee Dhruv Rathee Dhruv Rathi Parliament of India Parliament speech Parliamentary debate Legal Legal Advice Foreign funding Foreign
