,title,url,keywordes
202,How Elon Musk became World's Richest Man? | Dhruv Rathee,https://www.youtube.com/watch?v=m-58eOTlodQ,dhruv rathee latest video khan sir patna indian youtuber dhruv rathee elon musk twitter elon musk amber heard elon musk twitter news elon musk buys twitter elon musk shiba inu coin world richest man 2022 elon musk met gala elon musk biography did elon musk buy twitter 44 billion dollars in rupees parag agrawal tejran twitter elon musk net worth elon musk net worth in indian rupees elon musk twitter hindi elon musk biography twitter
203,Arnab Goswami WhatsApp Chat Leak | Explained by Dhruv Rathee,https://www.youtube.com/watch?v=TyAmoIeaN9E,Dhruv Rathee Dhruv Rathee Dhruv Rathee latest video india news live indian youtuber Narendra Modi Rahul Gandhi Arnab Goswami WhatsApp Arnab Goswami WhatsApp chat Arnab Goswami WhatsApp chat leak Facebook WhatsApp privacy policy Social Media Republic TV Indian media Arnab leaked TRP BARC What is TRP TRP Scam BARC CEO
204,"What are Bitcoin Alternatives? | Ethereum, Ripple, Litecoin Cryptocurrency Explained | Dhruv Rathee",https://www.youtube.com/watch?v=L4G3q1IMgMM,Dhruv Rathee Dhruv Rathee Dhruv Rathee latest video india news live indian youtuber Narendra Modi Rahul Gandhi Bitcoin in India Bitcoin Mining What is Bitcoin Bitcoin in Hindi Bitcoin trading Cryptocurrency Bitcoin kya Hai How to earn bitcoin Bitcoin Price How to buy in Bitcoin How to invest in bitcoin Coinbase Best Crypto App Best bitcoin app Litecoin Ripple Ethereum What are Altcoins Bitcoin alternatives
205,WhatsApp Privacy Policy Update Explained! | Dhruv Rathee | WhatsApp vs Telegram vs Signal,https://www.youtube.com/watch?v=2yluL1DZ70U,Dhruv Rathee Dhruv Rathee Dhruv Rathee latest video india news live indian youtuber Narendra Modi Rahul Gandhi WhatsApp WhatsApp Privacy Policy WhatsApp privacy Policy update Is WhatsApp Safe WhatsApp vs Telegram WhatsApp vs signal Telegram vs Signal Facebook Facebook Data Privacy Messenger Data Sharing Facebook WhatsApp Data Sharing Whatsapp Status WhatsApp status video WhatsApp status song WhatsApp new privacy policy update Khan Sir VPN
206,Chinese Billionaire Jack Ma Missing! | Dhruv Rathee,https://www.youtube.com/watch?v=-seG9em_m2Q,Dhruv Rathee Dhruv Rathee Dhruv Rathee latest video india news live indian youtuber Narendra Modi Rahul Gandhi Jack Ma Jack Ma Missing China Chinese Communist Party What is Capitalism Billionaire Chinese Billionaires Alibaba Amazon Paypal e-commerce Mutual Funds Alibaba valuation Alipay Alipay stock market Stock Market Rise of Jack Ma How Jack Ma became rich khan sir khan sir patna khan gs research centre khan sir official
207,Donald Trump & US Capitol Incident | Explained by Dhruv Rathee,https://www.youtube.com/watch?v=CXbIMijGfF0,Dhruv Rathee Dhruv Rathee Dhruv Rathee latest video india news live indian youtuber Narendra Modi Rahul Gandhi USA Donald Trump US Elections US Capitol US Capitol incident Hindi Joe Biden Trump Bhakts Andh Bhakts Trump supporters US parliament Washington DC Trump protests Us protests
208,The Covaxin Controversy | Explained by Dhruv Rathee,https://www.youtube.com/watch?v=QJ9zfgHmA90,Dhruv Rathee Dhruv Rathee Dhruv Rathee latest video india news live indian youtuber Narendra Modi Rahul Gandhi coronavirus Covaxin Covishield COVID-19 COVID19 Vaccine COVID-19 Vaccine approved Vaccine approved Coronavirus Vaccine Pfizer Moderna Vaccine Vaccination in India healthcare
209,Goa Mollem Protests: The Fight Against Coal | Dhruv Rathee,https://www.youtube.com/watch?v=geVg2G6sOzk,Dhruv Rathee Dhruv Rathee Dhruv Rathee latest video india news live indian youtuber Narendra Modi Rahul Gandhi Goa Goa Mollem mollem national Park Goa Mollem Protest Bhagwan Mahaveer national park Goa best beaches beach goa Adani Ambani Reliance energy Renewable energy Coal Coal Energy Railway Lines Goa protests
210,Did Caste Reservations destroy India? | Dhruv Rathee ft. @Soch by Mohak Mangal,https://www.youtube.com/watch?v=3QGEOCm6UQs,Dhruv Rathee Dhruv Rathee Dhruv Rathee latest video india news live indian youtuber Narendra Modi Rahul Gandhi Caste Caste Reservation Should Caste Reservation Exist Dalit Brahmins Britishers Indian Caste System Why Reservations Bihar Election Bihar Elections 2020 Nitish Kumar Tejashwi Yadav Kanhaiya Kumar Ambedkar BR Ambedkar
211,Dangerous Mutation? New Strain of Coronavirus | Explained by Dhruv Rathee,https://www.youtube.com/watch?v=e8z9G2IQMO0,Dhruv Rathee Dhruv Rathee Dhruv Rathee latest video india news live indian youtuber Narendra Modi Rahul Gandhi New Strain of coronavirus New strain of virus COVID-19 new strain Mutation What is Mutation COVId-19 Mutation COVID19 mutation COVID19 New Strain COVID Vaccine Vaccine Pfizer Moderna COVID 19 mutation Coronavirus Mutation Is vaccine effective UK Boris Johnson Flight Ban Lockdown India new strain
212,India's New Parliament Building | Central Vista Project | Dhruv Rathee,https://www.youtube.com/watch?v=LiP7zpryGac,Dhruv Rathee Dhruv Rathee Dhruv Rathee latest video india news live indian youtuber Narendra Modi Rahul Gandhi New Parliament Indias New Parliament New Parliament Building Modi foundation stone Parliament of India Lok Sabha Rajya Sabha Central Vista Project New Parliament of India New Delhi Cost of Parliament Kashi Vishwanath Statue of Unity
213,Reality of W********* | Dhruv Rathee,https://www.youtube.com/watch?v=WaH10gQccdI,Dhruv Rathee Dhruv Rathee Dhruv Rathee latest video india news live indian youtuber Narendra Modi Rahul Gandhi Byjus Whitehat jr White Hat Wolf Gupta Edtech Education Technology Learn Coding Coding for kids ad Google Crore Package in a job App development Smartphone development Byju
214,Farmers Protest Update | Dhruv Rathee,https://www.youtube.com/watch?v=MR4eRqcX4mE,Dhruv Rathee Dhruv Rathee Dhruv Rathee latest video india news live indian youtuber Narendra Modi Rahul Gandhi Farmers Protest Why are farmers protesting Anna hazare Farmer laws Proposal of Modi govt Why farmers rejected the proposals Adani Ambani Mukesh Ambani Reliance Jio Bharat Bandh protest of farmers Delhi farmers protest Agriculture December 14 Amit shah Arvind Kejriwal Diljit Dosanjh Kangana Ranaut
215,Bitcoin kya hai? How Bitcoin works and why is it so popular? | Dhruv Rathee,https://www.youtube.com/watch?v=sh7jXV3nwUo,Dhruv Rathee Dhruv Rathee Dhruv Rathee latest video india news live indian youtuber Narendra Modi Rahul Gandhi Bitcoin in India Bitcoin Mining What is Bitcoin Bitcoin in Hindi Bitcoin trading Cryptocurrency Bitcoin kya Hai How to earn bitcoin Bitcoin Price How to buy in Bitcoin How to invest in bitcoin Zerodha Coinbase Best Crypto App Best bitcoin app
216,Farmers Protest in Delhi | Explained by Dhruv Rathee,https://www.youtube.com/watch?v=-kmDsLp0xnw,Dhruv Rathee Dhruv Rathee Dhruv Rathee latest video india news live indian youtuber Narendra Modi Rahul Gandhi Farmers Protest Farmer Protests Farmer Bills Farm Bills Why are Farmers Protesting farmer bill 2020 farmer protests in india Delhi Farmers punjab Justin Trudeau Canada Punjab Farmes Haryana Kisan Kisan Andolan
217,Which Indian State has Best Nutrition? | Dhruv Rathee,https://www.youtube.com/watch?v=ssCsEEKuN4I,Dhruv Rathee Dhruv Rathee Dhruv Rathee latest video india news live indian youtuber Narendra Modi Rahul Gandhi Nutrition in India Best State in India Best Diet Weight loss tips Best weight loss Weight Loss diet Balanced Diet Kerala Haryana Vegetarian weight loss Vegetarian diet Indian vegetarian Diet Protein for vegetarian Myprotein Food Health
218,COVID-19 Vaccine Update | Dhruv Rathee,https://www.youtube.com/watch?v=kWws30Z6yo4,Dhruv Rathee Dhruv Rathee Dhruv Rathee latest video india news live indian youtuber Narendra Modi Rahul Gandhi COVID-19 Vaccine Update Covid-19 Vaccine COVID vaccine Coronavirus Vaccine Pfizer Vaccine Moderna Vaccine Oxford Vaccine When will we get COVID19 vaccine Side effects of Vaccine Are Vaccines safe Bharat Biotech India Covid19 vaccine COVID19 Vaccine Update
219,Can Indian Banks Revive from NPA Crisis? | Dhruv Rathee,https://www.youtube.com/watch?v=2DqUhTpgShQ,Dhruv Rathee Dhruv Rathee Dhruv Rathee latest video india news live indian youtuber Narendra Modi Rahul Gandhi Yes bank NPA Bad Loans NPA Crisis SBI Bank NPA Ratio Indian Bank Economy GDP GDP Growth Investment Assets Hdfc bank yes bank latest news Money Loans Interest Rate Vivek Kaul
220,The Danger of OTT Regulation | Dhruv Rathee,https://www.youtube.com/watch?v=EKIEu7CO078,Dhruv Rathee Dhruv Rathee Dhruv Rathee latest video india news live indian youtuber Narendra Modi Rahul Gandhi OTT Netflix Amazon Prime Video Hotstar Disney+ Disney+hotstar Latest Netflix film OTT Regulations End of Netflix Digital News The Wire.in Scroll Quint Digital News Regulations Prime Video Alt Balaji Censorship VPN NordVPN Best VPN
221,How Joe Biden Won? | US Elections Analysis by Dhruv Rathee,https://www.youtube.com/watch?v=5W9-MJXvtFI,Dhruv Rathee Dhruv Rathee Dhruv Rathee latest video india news live indian youtuber Narendra Modi Rahul Gandhi Joe Biden US Elections USA Elections Presidential Elections Donald Trump Trump lost Trump loss Biden wins Biden win American Elections America Electoral College Senate House of Representatives Kamala Harris Joe biden vs trump Joe biden speech trump biden Joe biden india elections 2020
222,Arnab Goswami Arrest! | Explained by Dhruv Rathee,https://www.youtube.com/watch?v=hGtrTjeENf4,Dhruv Rathee Dhruv Rathee Dhruv Rathee latest video india news live indian youtuber Narendra Modi Rahul Gandhi Arnab Goswami Kunal Kamra Arnab Goswami Arrest Republic TV Anvay Naik Times Now Mumbai Police kangana Ranaut Maharashtra Uddhav Thackeray Shiv sena NCP Congress TRP Arnab Goswami Arrested
223,France Incidents and Blasphemy | Dhruv Rathee,https://www.youtube.com/watch?v=DPh3mj4uvU4,Dhruv Rathee Dhruv Rathee Dhruv Rathee latest video india news live indian youtuber Narendra Modi Rahul Gandhi France Blasphemy Religion Islam Muslims Freedom of Speech Freedom of Expression Liberalism Liberty Macron French President Church Paris Nice Boycott France Boycott French Products Prophet Mohammed Vienna
224,Is Bangladesh better than India now? | Dhruv Rathee,https://www.youtube.com/watch?v=cTRXYlgcBFQ,Dhruv Rathee Dhruv Rathee Dhruv Rathee latest video india news live indian youtuber Narendra Modi Rahul Gandhi Bangladesh India vs Bangladesh GDP Growth GDP per capita IMF Why Bangladesh is better than India India Indian economy Mutual Funds Kuvera Investing Economic growth Modi Country Comparision India vs Pakistan India vs China Stock Market
225,Reality of Caste Reservation | Dhruv Rathee ft. @Soch by Mohak Mangal,https://www.youtube.com/watch?v=L6by13GyZtc,Dhruv Rathee Dhruv Rathee Dhruv Rathee latest video india news live indian youtuber Narendra Modi Rahul Gandhi Caste Caste Reservation Should Caste Reservation Exist Dalit Brahmins Britishers Indian Caste System Why Reservations Bihar Election Bihar Elections 2020 Nitish Kumar Tejashwi Yadav Kanhaiya Kumar
226,Harsh Truth behind Billionaire Scams | Dhruv Rathee,https://www.youtube.com/watch?v=_nT2WXzXfGA,Dhruv Rathee Dhruv Rathee Dhruv Rathee latest video india news live indian youtuber Narendra Modi Rahul Gandhi Vijay Mallya Nirav Modi Bad Boy Billionaires Billionaires Billionaire Scams Reserve bank of India Shell companies Tax Havens UK Economic Fugitives Extradition Kingfisher Jio Mukesh Ambani Indias richest man
227,IPL 2020: Data Science of Winning | Dhruv Rathee,https://www.youtube.com/watch?v=fnHEDbFsZEE,Dhruv Rathee Dhruv Rathee Dhruv Rathee latest video india news live indian youtuber Narendra Modi Rahul Gandhi IPL 2020 IPL Science behind IPL Data Science Upgrad Unacademy Data Science of IPL Who will win IPL 2020 MS Dhoni Virat Kohli live ipl ipl highlights 2020 ipl live ipl highlights 2020 ipl live match Dream11 Hotstar Cricket
228,TRP Jumla of Republic TV | Dhruv Rathee,https://www.youtube.com/watch?v=6z0ZQ6Qcuns,Dhruv Rathee Dhruv Rathee Dhruv Rathee latest video india news live indian youtuber Narendra Modi Rahul Gandhi Republic TV Arnab Goswami TRP What is TRP How is TRP calculated TRP Scam BARC India Today Top News channel india NDTV Bajaj Advertisers NDTV vs Republic TV Ravish Kumar TRP Jumla Television Ratings
229,Armenia vs Azerbaijan | Explained by Dhruv Rathee,https://www.youtube.com/watch?v=PEg0JgyVkyE,Dhruv Rathee Dhruv Rathee Dhruv Rathee latest video india news live indian youtuber Narendra Modi Rahul Gandhi Armenia Azerbaijan Armenia vs Azerbaijan Putin Russia Geopolitics USA Donald Trump Karabakh Baku Aliyev Nikol Pashinyan President of Azerbaijan Turkey Erdogan
230,Hathras Coverup | Explained by Dhruv Rathee,https://www.youtube.com/watch?v=3KOLG472t8c,Dhruv Rathee Dhruv Rathee Dhruv Rathee latest video india news live indian youtuber Narendra Modi Rahul Gandhi Hathras Uttar Pradesh Hathras Case Yogi Adityanath BJP Rajasthan UP Police what happened in hathras Aaj Tak Lallantop Ground Report Yogi raj BJP IT cell PR Agency
231,Truth behind your Whatsapp Data  | Dhruv Rathee,https://www.youtube.com/watch?v=JPNnDQhuGAo,Dhruv Rathee Dhruv Rathee Dhruv Rathee latest video india news live indian youtuber Narendra Modi Rahul Gandhi Deepika Padukone Bollywood Navika Kumar Republic TV Godi Media Arnab Goswami Kangana Ranaut Nordvpn VPN Data Privacy Data Security Whatsapp Whatsapp Tricks WhatsApp how to read chats Whatsapp tips and tricks End to end encryption
232,How Farmers Bills passed Rajya Sabha! | Dhruv Rathee,https://www.youtube.com/watch?v=i9IjiW5pULc,Dhruv Rathee Dhruv Rathee Dhruv Rathee latest video india news live indian youtuber Narendra Modi Rahul Gandhi Farmers bill Farmers Rajya Sabha Derek O Brein Congress BJP TMC Voice Vote Division Vote Lok Sabha Parliament of India Speaker of House Bills Democracy Modi Farmers Ordinance
233,Why are Farmers Protesting? | Farm Laws Explained | Dhruv Rathee,https://www.youtube.com/watch?v=Dj4rGHzc-3A,Dhruv Rathee Dhruv Rathee Dhruv Rathee latest video india news live indian youtuber Narendra Modi Rahul Gandhi Farmers Indian farmers Ordinances Farmer Ordinances Farmer protests haryana Punjab Modi Govt Agriculture Policy Indian Agriculture Policies Free Markets Neoliberalism Liberalism What is APMC APMC
234,"Kangana Ranaut, BMC and Rhea Controversy | Dhruv Rathee",https://www.youtube.com/watch?v=V2Uf0evaoMI,Dhruv Rathee Dhruv Rathee Dhruv Rathee latest video india news live indian youtuber Narendra Modi Rahul Gandhi Kangana Ranaut Rhea Rhea latest news BMC Uddhav Thackeray Sanjay Raut Shiv Sena BJP Modi Congress Bollywood Nepotism Alia bhatt Kangana Kangana Controversy Ananya Pandey Bollywood industry
235,GDP Crash and PUBG Ban | By Dhruv Rathee,https://www.youtube.com/watch?v=otu95zL7S3k,Dhruv Rathee Dhruv Rathee Dhruv Rathee latest video india news live indian youtuber Narendra Modi Rahul Gandhi GDP Growth India GDP Growth Negative GDP Growth Economy Indian economy JEE NEET SSC GDP crash India Inflation Unemployment PUBG PUBG Ban PUBG Ban india Indian gaming Manmohan Singh Modi hai toh mumkin hai
236,How to start a Youtube Channel and Earn Money? | By Dhruv Rathee,https://www.youtube.com/watch?v=O3jMpgA5Ww4,Dhruv Rathee Dhruv Rathee Dhruv Rathee latest video india news live indian youtuber How to make YouTube videos How to make YouTube channel How to create YouTube channel How to earn money from Youtube Start a YouTube channel Beginners guide Free Video editing app Best video editor how to edit videos Mobile video editing app VITA Free videomaker
237,Prashant Bhushan Case | Interview with Dhruv Rathee,https://www.youtube.com/watch?v=zXlQqtTrscU,Dhruv Rathee Dhruv Rathee Dhruv Rathee latest video india news live indian youtuber Narendra Modi Rahul Gandhi Prashant bhushan Arnab goswami supreme court Supreme Court of india Contempt of Court what is contempt of court Arun Mishra SSc JEE NEET Carryminati Netflix Prashant Bhushan Case Interview with dHruv Rathee Prashant Bhushan Interview Arvind Kerjiwal Kafeel Khan Dr Kafeel Khan
238,How Belarus is overthrowing their Dictator! |  Dhruv Rathee,https://www.youtube.com/watch?v=Mj8_buWV2Cc,Dhruv Rathee Dhruv Rathee Dhruv Rathee latest video india news live indian youtuber Narendra Modi Rahul Gandhi Belarus russia Poland Ukraine Belarus Protests Belarus Country Putin Alexander Lukashenko Lukashenko Trump World Politics Geopolitics Lebanon Democracy International news Elections Prashant Bhushan Carryminati Flying Beast
239,Why Postpone JEE & NEET Exams? | Dhruv Rathee,https://www.youtube.com/watch?v=qy2Nff12BOk,Dhruv Rathee Dhruv Rathee Dhruv Rathee latest video india news live indian youtuber Narendra Modi Rahul Gandhi JEE NEET JEE Exam JEE NEET JEE Latest update NEET Latest update Exams in India Postpone Exams COVID-19 Coronavirus COVID-19 update india Latest news india Exams postpone India UGC
240,Bangalore Violence 2020 | Explained by Dhruv Rathee,https://www.youtube.com/watch?v=QBa2MSdNG-I,Dhruv Rathee Dhruv Rathee Dhruv Rathee latest video india news live indian youtuber Narendra Modi Rahul Gandhi Bangalore Bangalore riots Bangalore Violence Bangalore Mosque Muslims Hindi NDTV Ravish Kumar DJ halli Amit Shah Bangalore Police Karnataka Congress MLA BJP Prophet Mohammed Zakir Naik Islam Wali Rahmani
241,Lebanon Crisis: Entire Govt Resigns | Explained by Dhruv Rathee,https://www.youtube.com/watch?v=fuPMxdZOcdA,Dhruv Rathee Dhruv Rathee Dhruv Rathee latest video india news live indian youtuber Narendra Modi Lebanon Lebanon political system Beirut Lebanon crisis Economy Economic Crisis Inflation Expensive country International politics USA Iran Saudi Arabia Spotify Govt resigns Middle East Greece
242,World's Most Expensive Country | Ground Report by Dhruv Rathee,https://www.youtube.com/watch?v=ColmyavhSBo,Dhruv Rathee Dhruv Rathee Dhruv Rathee latest video india news live indian youtuber Narendra Modi Rahul Gandhi Ground Report Ground Report by Dhruv Rathee Most Expensive Country Swiss Currency Swiss banks Millionaires Worlds most expensive country Dhruv Rathee net worth Switzerland Swiss Francs Finance Cost of living Cost of living index Highest cost of living
243,Article 370: One Year Later | Dhruv Rathee ft. Angry Prash,https://www.youtube.com/watch?v=Y6sGTmLRcps,Dhruv Rathee Dhruv Rathee Dhruv Rathee latest video india news live indian youtuber Narendra Modi Rahul Gandhi Article 370 Article 370 One year later Article 370 Removal Jammu and Kashmir Kashmir Internet in Kashmir 2G Internet 4G internet Lockdown Kashmir Angry Prash Jammu tourism in kashmir Economy Economic impact of Article 370 Ram Mandir Amit shah
244,The Story of Dr. Kafeel Khan | Explained by Dhruv Rathee,https://www.youtube.com/watch?v=lcvxLBV-UQE,Dhruv Rathee Dhruv Rathee Dhruv Rathee latest video india news live indian youtuber Narendra Modi Rahul Gandhi Kafeel Khan Uttar Pradesh Yogi Adityanath Dr. Kafeel Khan Story of dr. Kafeel khan Carryminati Flying Beast Doctors Indian Medical Association AIIMS COVID-19 Doctors in India Medicine Medical Science in India
245,New Education Policy | Analysis by Dhruv Rathee,https://www.youtube.com/watch?v=8tiQuiCdbkM,Dhruv Rathee Dhruv Rathee Dhruv Rathee latest video india news live indian youtuber Narendra Modi Rahul Gandhi New Education Policy NEP 2020 New Education Policy Analysis Education Ministry Sanskrit Language Mother Tounge Education system India vs Germany Education India vs Singapore Education Indian Education System Entrepreneurship Byju
246,Why Assam Floods Every Year? | Assam Floods 2022 | Dhruv Rathee,https://www.youtube.com/watch?v=wYThZL2aMH8,Dhruv Rathee Dhruv Rathee Dhruv Rathee latest video india news live indian youtuber Narendra Modi Rahul Gandhi Assam Assam floods Floods in Assam Netherlands Flood Control Brahmaputra Floodplains What is Embankment Embankments Levee Brahmaputra River Climate Change Deforestation assam news live assam news 2019 north east india Assam floods news Bihar floods Bihar Bihar news assam news assam floods 2022
247,Gunjan Saxena: Reality of Women in Armies | Dhruv Rathee | Netflix India,https://www.youtube.com/watch?v=WpeN2FDbIGM,Dhruv Rathee Dhruv Rathee Dhruv Rathee latest video india news live indian youtuber Narendra Modi Rahul Gandhi Gunjan Saxena Gunjan Saxena Trailer Gunjan Saxena Kargil Girl Janhvi Kapoor Netflix Amazon Prime Class of 83 Bollywood Feminism Latest Bollywood film Nepotism Air Force Indian Air Force true story of Gunjan saxena real story of Gunjan saxena gunjan saxena official trailer gunjan saxena trailer gunjan trailer
248,Rajasthan Crisis: Pilot vs Gehlot | Explained by Dhruv Rathee,https://www.youtube.com/watch?v=GtzukUL-AX0,Dhruv Rathee Dhruv Rathee Dhruv Rathee latest video india news live indian youtuber Narendra Modi Rahul Gandhi Rajasthan Sachin Pilot Ashok Gehlot Rajasthan Govt Audio Tapes Rajasthan news Sachin Pilot news Anti defection law BJP Congress Rajasthan CM Ashok Gehlot news Carryminati
249,Launching a New Channel | Dhruv Rathee,https://www.youtube.com/watch?v=K_jUpdVnYKw,Dhruv Rathee Dhruv Rathee Dhruv Rathee latest video india news live indian youtuber Narendra Modi Rahul Gandhi Dhruv rathee Vlogs Million Special Who is dhruv rathee Dhruv Rathee girlfriend Dhruv rathee latest Travel India's best travel vlogger travel vlogger vlogger vlogging Flying beast Carryminati
250,Turkey's Hagia Sophia and Erdogan | Dhruv Rathee,https://www.youtube.com/watch?v=NXVxDtvXZO8,Dhruv Rathee Dhruv Rathee Dhruv Rathee latest video india news live indian youtuber Narendra Modi Turkey Secularism Hagia Sophia Hagia Sopia explained History of Turkey Erdogan President of Turkey Istanbul Erdogan in Hindi Hindi Inflation GDP Growth Economy Museum Hagia Sophia history
251,How EIA 2020 will Damage India! | Dhruv Rathee,https://www.youtube.com/watch?v=tWCjhj035WY,Dhruv Rathee Dhruv Rathee Dhruv Rathee latest video india news live indian youtuber Narendra Modi Rahul Gandhi EIA 2020 EIA draft Environment Impact assessment Ecology Indian biodiversity Environment Climate Change Environment Ministry Carryminati Pollution Air pollution Coal Renewable Energy Solar plant IFS upsc
252,Was Vikas Dubey Encounter Fake? | Dhruv Rathee,https://www.youtube.com/watch?v=j6iFQTZPNRA,Dhruv Rathee Dhruv Rathee Dhruv Rathee latest video india news live indian youtuber Narendra Modi Rahul Gandhi Vikas Dubey Vikas dubey Encounter Vikas Dubey latest news Vikas Dubey Akhilesh Yogi Adityanath Uttar Pradesh dubey news kanpur Akhilesh Yadav justice Vikas dubey ka video Judiciary UP Police
253,Reality of COVID-19 Vaccine | Dhruv Rathee,https://www.youtube.com/watch?v=vt2tcaeQXI0,Dhruv Rathee Dhruv Rathee Dhruv Rathee latest video india news live indian youtuber Narendra Modi Rahul Gandhi COVID-19 COVID-19 Vaccine covid-19 vaccine latest update latest news vaccine bharat biotech coronil baba ramdev Indian vaccine Covaxine What is covaxin Coronil reality coronavirus vaccine news coronavirus
254,COVID-19 Impact on Education | Dhruv Rathee,https://www.youtube.com/watch?v=6Ze8O334KzQ,Dhruv Rathee Dhruv Rathee Dhruv Rathee latest video india news live indian youtuber Narendra Modi Rahul Gandhi Exam cancelled CBSE ISCE JEE JEE Exam NEET Exam Education Impact of COVID-19 Fees Hike Private Schools in India School fee hike Exam delayed ugc exam guidlines jee 2020 latest news CBSE Board exams Board exam tips CBSE Exam tips
255,TikTok Ban and Hong Kong Situation | Dhruv Rathee,https://www.youtube.com/watch?v=KjiizZng_Y0,Dhruv Rathee Dhruv Rathee Dhruv Rathee latest video india news live indian youtuber Narendra Modi Rahul Gandhi tiktok ban Tiktok Tiktok banned in India China Xi Jingping Hong Kong What is happening in Hong Kong Tiktok ban reactions Chinese app ban 59 chinese apps Chinese Intelligence Law Privacy Data Protection VPN Kuvera Mutual Funds Hong Kong new law Democracy
256,Why Conspiracy Theories Spread | Explained by Dhruv Rathee,https://www.youtube.com/watch?v=9qHE5qmrGiY,Dhruv Rathee Dhruv Rathee Dhruv Rathee latest video india news live indian youtuber Narendra Modi Rahul Gandhi Conspiracy Theory Conspiracy Theories Explained Debunking Conspiracies Bill Gates 5G towers Vaccines Are Vaccines safe Illuminati Illuminati explained Coronavirus COVID-19 Coronavirus conspiracies China Wuhan George soros New World Order Why people believe in conspiracies
257,Flying Beast Interview: Is Air Asia Safe? | Dhruv Rathee,https://www.youtube.com/watch?v=c5XzDqkv0cE,Dhruv Rathee Dhruv Rathee Dhruv Rathee latest video india news live indian youtuber Narendra Modi Rahul Gandhi Flying Beast Gaurav Taneja Ritu Rathee Flying Beast latest video Air Asia Airlines Flap 3 Full flap landing Aircraft Landing Flight Safety Emirates US Airlines Best Airlines flying beast latest Air india Pilot Pilot as a job how to be a pilot
258,Boycott China: The Harsh Truth | Dhruv Rathee,https://www.youtube.com/watch?v=DX66d_4JtBU,Dhruv Rathee Dhruv Rathee Dhruv Rathee latest video india news live indian youtuber Narendra Modi Rahul Gandhi China India China Ladakh India China Border remove china apps tiktok carryminati india china news trade export import export subsidy CCP Boycott China india vs china galwan river valley india china standoff How to boycott china US china trade Free trade boycott chinese products
259,Why the World must Boycott China! | Dhruv Rathee,https://www.youtube.com/watch?v=F_0H2TVywRQ,Dhruv Rathee Dhruv Rathee Dhruv Rathee latest video india news live indian youtuber Narendra Modi Rahul Gandhi China India China Ladakh India China Border remove china apps tiktok carryminati india china news debt trap trade export import export subsidy CCP Boycott China india vs china galwan river valley india china standoff
